type,post1,post2,post3,post4,post5,post6,post7,post8,post9,post10,post11,post12,post13,post14,post15,post16,post17,post18,post19,post20,post21,post22,post23,post24,post25,post26,post27,post28,post29,post30,post31,post32,post33,post34,post35,post36,post37,post38,post39,post40,post41,post42,post43,post44,post45,post46,post47,post48,post49,post50
ENTJ,thought fucking w sx hostility ring freaking image type fucking narcissistic streak instead one kind,although day brb going another website circle jerk satisfy ego,true value malleable way metaphor mirror hold true s come understanding human interaction lens perspective,would like necro thread thank op shedding light ni dominant jcf delving obsessively typology around year recently figured,funny jung note fi doms morph extremity case reject ounce feeling left stereotype,process elimination j p axis always factor blindly misleading general populace finding identity true type never main,dad isfx w mom w lil bro w w,seems pure neutral expression alone value fi tend look unapproachable default thus rbfs criterion hold applicable general population raw fi ntjs,dear mom please stop trying conform expectation good son like please meddle business regarding future sincerely son first seek,think come introversion characteristic trait highly sensitive person fit criterion introvert long interfere reality,lol dat rbfs phenomenon well experience fit criterion resting bitchface syndrome society repelled people coupled seemingly arrogant vibe tend,dominant fe auxiliary fe user spot bullshit clash ti sometimes though met ne aux ne user irl yet iirc,premise thread explain projection demonic personality complex archetype bebee model ixtp might become envious resentful people seen morally,depends individual s generally minimalist core though n especially one si,find silly absurd thing like hlarious guy thought troll different reason,recent news stating space shuttle landed unbeknownst land man land could described form highly polished temple located,u s tend excessively doubt reasoning self get point depression mention inferior fe always ready latch onto u thing get much,dis compare contrast skill video game requires delve mechanic get slight advantage term dealing real time done,able sense ambiance given atmosphere depending context would say evaluate ambiance simplistic feeling tone contrast say,busy head notice double post,hahaha mainly response personal experience afflicted social anxiety almost half life responding tongue cheek manner s,relate lot suggest read beebee model state dominant thinker would mistake emotional feeler lot overlapping,take face value instert involuntary emotional response,w ti e type mbti correlation one believe mbti type attributed e type make sense exception course,anything concluded discovered real s grip tertiary fi user would focused purity one,sound like catch keep wink going hibernation mode toodles laughing,look like model long attractive able match physically bed intellectually emotionally look intensity depth real relationship,late like chip well dropped high school age afterwards lived isolation pretty much good number year sure loser,change previous request translucent,care type,well way experienced come man hair even unaware term google came,look clean cut shaven good skin complexion well good bro,excuse,congrats,s shown thread fe ti pair merely see perceived personal attack higher thou holy attitude definitely,way see one fix anyone period choosing interact person question path enlightened universe brings multitude event,hmm test b people prone perception bias especially dabbled cognitive function bias predominantly inherent n ridicule could,please post whole result cognitive function test bolded would indicate use dominant se italicised suggest delve generalisation,,ever occurred possibly unhealthy quite clear making thread try move emotionally stable healthy,let google going sum argument spot logical fallacy found mindblown,introvert problem,dat joking aside,could change mine tentative transitoire thank,agree instead delving deeper inner vortex succumbing addiction mask pain delve pain start loving think otherwise,haha oh wow make wonder relevance perfectionistic tendency becoming pedantic grammar punctuation tendency would manifest e type,personal attack justified sure provided enough data variable consistent rigorous logical experimentation consisting carrot,ideal,real,introversion
ENTJ,equally interested ghost theory unsupported evidence get interest least couple second,india patent office reject bayer appeal cheaper version cancer drug washington post yes please news like,hard accept progress need wait situation right year old lot project forced academic reason spend month,te actually interacting objective element study text information need know may asked let objective come,maybe feel like used mainly te method learning get drained suggest try get understanding trying learn,noooo suicide never answer sorry first thing imagined post mind elaborating,certainly ask take answer give instead asking thousand question become self conscious,mean sorry driving like baby mother making,bad example appropriate hiv treatment basically brings risk transmission zero understand point competition ressources indeed better,without tackling specific topic discussed due lack interest consequently knowledge regarding diet proof theory two different thing science especially clinical,interpret something essential live meaningful life clearly misinterpreting mbti take break real life get back later,honestly part really depends fjs mean mental image someone like know quite bad foreseeing,thelaughingman post great question make fall point would legitimate question wanted get attention since actually,w righ hand w,think te make someone honest default basically got powerful process going find answer something efficiently want dishonest need lot brain power,static opinion abstract concept free market capitalism abstract fuck think people wanting something give value believe free market,dear colleague finally able type one people like talking used people taking unconventional idea joke make like,think,quite get phrase post modern fear reaction mean data support link least u conservatism amygdala reaction e aversive,worth lessemo meant anarchist conspiracy theorist people believe anarchist conspiracy something like reasonable basis belief,get rich keep attitude people abuse still believe one profiting con man wet dream,way found deal non informed pessimist defend opposite thesis equal superior energy course historical tendency neither prescriptive divination,well think best way power money severely limiting potential power money buy sale make everything zero sum game ability,penguin sure think power,alright play feeling like outstanding memory make true feeling like make disappear experience si dominant,yes called american dreamtm,elli bell whole self conscious side op show using fe seems disqualify primary function potentially uncomfortable social situation fe dominant find,actually find nice disagree got time discussion today mention minute come op answer question mention minute,feel good comparison psychology theory wisdom priest lived year ago,acerbusvenator since post great like point something regarding description intuition ne v ni would avoid put people part feed common,nice everyone completely disagrees nighti disagree strongly te part investigating problem couple minute realizing qualified te te need,meowww extrovert seem running away introspection subjective discomfort e boredom might afraid connect,understand afraid change think feel value get different anymore want someone recall stuff said,interesting get conclusion regarding function si beginning get much place afterwards ne showed lot way answered question,presentation like seasoned profesionals remember presentation like even everyone get presentation thinking unsure one,according household income united state wikipedia free encyclopedia expect salary top american household single year old debt,doctor,honestly hit hard started internship like hell satisfied tell made mistake understood somehow people,money something interesting probably assured part academic success find thinking money boring sure,think need feeler oddly enough due career path spent enormous amount energy thinking people general everything social important,surprising answer vague question would clarify kind success talking revenge motivate would allow u infer looking,think lot le internal dialogue many people worry almost nothing think much make decision know getting,see much people question mom tell gave life imo calling someone bullshit mark respect addition necessary autonomous,actually whole world getting le le violent continuing tendency last year aspect non violence come non zero sum game,nope unless kind evidence aware could benefit,finally sensible analysis arguing something different position well done made see se primary bit differently,take sound ti fe still think se likely would work reason would use function change fact really case,one overrated text time,think like,know meme
ENTJ,try first stop asking question try game maker studio standard edition free go tutorial youtube see like programming,hmm matter many time read still sounded like normal especially point pointed share much feeling felt might,damn get revengeeeeee,would waste time centuple confirm type like shifting every single day,need reconsider type anymore indeed,go ahead make world better place live,pesky test prove anything online test worth trouble burn whole website determine type depending cognitive,listen life live life another person life edit got backing,ikr get untypeable anyway fun,te much frequently used,,one untypeabletmu b,appear pretty obvious dominant use ne retype many time worry papa,female anyway know fine difference overall much confrontational think others see,god preference would love see questionnaire,want take look post,fi pointed sound analytical question mentioned share much feeling felt might reveal much,ni te likely take starting point work slowly carefully find something really see sure writing getting flow,isxp option fi guess dont share much feeling thought unless really trust someone well rarely would share art writing felt,yeh appeared much straightforward viable option right,ne proof dominant fe extroversion spent high school life hoping please harmonize group people usually think speaking,objection cue cornered theme music,,following suggests se definitely look reaction non reaction others guess get bored easily activity always try find new thing would,,,,,,ni,hi please start answering questionnaire,well signing want get straight mbti measure preference rather aptitude mean also good leader might,celebrity type website however trying proof word limit example trying say word accuracy precision ti oriented,started thinking loosing feel kinda late se party nonetheless feel great extroverted emulating se user course software,popular found another way bonded friendship partnership artist started venturing indie game development afterwards best decision ever find,first paragraph stereotypical though based observation person second sound like third sound like sound cliche ish like,three issue address post te lesser word think te anything lesser word steve job anyway te mean logic,lol please remain calm dude still remember thinking mbti weird club almost hug bunny almost mbti,long since celebrated birthday someone family always remembers grabbed opportunity nice secret recipe new york cheese cake p birthday,always end degree confident long trying figure see especially one friend,go flow okay though biggy need get page birthday suck long everyone happy,gasp could also mean way lolz jk enough people typing already xd btw ntj guaranteed,sadly never met recognize people yet got lucky met college year realized ex co founder,surrounded sj sp learnt around get ubercharged way like making look crazy joking around ha pretty,lol yeah placebo used think spend time alone introspection thinking sorta became second nature,sure though think answer used ntj test p following enthusiastic subject like,problem btw also get sloei really describe like say test may vary depending mood big five may reputation pretty accurate,confirmed welcome club seriously definitely people might interpret differently question came mostly,well far good gave impression way said thing rough estimate btw said horoscope totally pseudo different mbti,cough recently got rut imma help e always socializing socializing almost fe se dominant
ENTJ,daenerys targaryen never considers pragmatic ramification action let philosopher argue good evil also incredibly hypocritical statement make considering,like somewhat younger view situation term cost benefit likely outcome time someone dig heel person,dear xxxx ti stink tease apart possibility make assumption,consider another person equal consider another equal allow person intimate territory another matter two consul roman republic always,renowned parable yes prominent daoist next laozi wrote book also titled zhuangzi witty wise humorous emphasizes,certain chinese proverb sum sentiment two tiger cannot share mountain trouble relinquishing autonomy someone else want control,interestingly post count decreased several post soon posted one comment spam world hope data help,joke going anyone head thread distasteful attempt humor stereotype japanese culture people language bear mind thread first,depends person value career path wealth reputation autonomy ability work hour per week actually like want,taoism archaic wade giles romanization daoism pinyin romanization preferred spelling academia accurately reflects pronunciation word,daoism pretty darn awesome love actionless action wu wei principle read philosopher zhuangzi,,going die spoiler dude,tend thank comment constructive honest well reasoned also thank astute comment make stop think even may accept point expressed never thank,sound like unhealthy middle move towards touch make human others need healthy able open,visitor message notification issue must ghost machine,experienced several unwanted contact high state legalized recreational use caused become uncoordinated also loosened inhibition somewhat world mean get,,novel set published prior transformation,check bbc x digital game could cure tb download,intensity dominance inner peace,many crazy perc responded various thread made terrible statement type sex class etc banned based experience user,crooluniqorn see scenario board responds true pain as doubling threatening terminate filing injunction comment sjs seems,may case board member wish discus matter board provide best comprehensive answer question would request set date,always help practice perspective bear mind every person share value priority style make various value priority style,sound like clinical depression see doctor also think better served asking better perspective want need,pfffft,ditched xntp forum invasion s one look s s balking prank dead arrival next time entrust invasion xntjs,dudette lose invasion telling gtfo nodding smiling make war thin skinned humorless peon count s stand,need wear badge honor cannot loosen take joke fuck em,forum error,great keep goal mind also need take thing one step time point life career meaningful career probably going table,sound like fucking asshole sound bit desperate unsure going end well disengage,urgent poor choice part think pertinent appropriate word one favorite line dao de jing indifferent thing terribly,took op mean tried talk attempt snubbed met hostility denial incorrect indeed given ample space collect,kidding usual xntps late come touch drum set,reminds zen proverb aim turning away would permit space cool process whatever bother alternative think,avatar tiger time admittedly lame joke made stop picking trite fight man asked stop trolling committing ad hominem asking,ever think anxiety may related ne tendency see multiple outcome way see ask multiple time party provide clear answer party,thank jeb resistant advice questioning younger helped experience thing think many people need reminds quote confucius hear,anxious person would rather ask participant make point clear orderly possible becomes apparent person cannot,bad reserved nature prohibits appreciating positive friend acquaintance sorry seeing good excuse sound uptight need loosen,people liken current situation slavery entitled someone become said another thread read classic slave narrative ancient roman slavery anyone,always thought leave somewhere law either protest lobby vote whatever suppose make sense certain egregious law avoided,really well one long time friend absolutely love due strong difference complete honest opinion anyone,post rand quote evidence contrary see bald statement party incorrect much paulie need evidence,protest leave simple protester also know thrown prison risk know accept exists curious hear alternative democracy,seems really odd type te second stack could normally short attention span low motivation would research depression due low serotonin,correct law also mean threat key people consented law voted threat levelled despite residence,bookstore hears child loud voice end store behind stack child daddy quarter silence child need quarter
ENTJ,dear s seem like people like looking best aspect listen find compulsion feeling fascinating please tell okay hand,toughlilcookie tempting say might cornered wrong field work entirely wondering whether make work anyway unsure yet exactly,mygti pretty much really like anonymity allows open share board atleast standard quite lot especially sex relationship,eeved asking yes,dating another extrovert new experience dated introvert,,irrational decision making,,took work strength assessment test little idea apply result field work intend drastically change field sit bit,ask question willing answer,putting picture keep honest honesty wanting show face,handsome jack unhealthy one since s seem possibility taking people act someone feel trapped,insecurity currently relationship like foot long transparent fat blind cockroach thrive deep darkness bright light threatening,happiness vine,want one alright let try cannot imagine use imagining another type alter ego take would interested male version maybe,s see superior type everyone else general ye steve job napoleon esque hard charging type prefer,still unsure much communicate relationship much leave adjust feeling uncertainty easy rush,left smoke dissipating lingering,prada know firmly operating emotionally manipulative emotional blackmailing could see wanting keep peace would strike stand,xsfj getting along people stand preserve niceness status quo strain infx materialism idealistic quite vocal aggressive extj might,,recognize someone want somehow sadness comply course maybe pleasing created anyway,parent older brother like,ex still contact one stable earth guy know way disastrously crashed burned might mostly immature,butter cooky shortbread peace offering,diy planner,need know behave functioning well keeping tab want child take care home place take armor,hanging friend baking feeding people lately hogging significant well,,furryfury thank thinking keeping google sheet file making easier highlight designate color move around pretty obvious lot,,advice household everyday financial planning vaguely aware horrible family day day spending habit mother brother actually starting,quick get hurt child rather jockish child retrospect someone bullied crybaby bully get fight however,animal oh nothing dire anguished slightly misbehaved absolutely regret good song though familiar artist singer,intention make excuse apology sorry,figuring feeling often worth time irrelevant important anyway dealing personal relationship feeler,thinking still getting used said several time think much saw processing something happened remark conversation,,case mostly realization order trying get hurt one often end hurting oneself scary choosing vulnerable without careless balance,gene care human happiness physical compatibility dizzying chemistry mean happiness surely follow want happy,,thank well except one finished writing post realized cannot would actually contact would somewhere disrespectful,hello attempt keep brief long distance relationship friend year dated talked everything everyday wonderful,eeved personally know s approach feeling difficult default open many confusing experience tend,decided trust,,please see reaching someone see take hand let see wake tomorrow best laid plan sometimes one night,little bird series realized point one choose jaded without unwise around late early even lower seemed plenty woman already burnt,eeved define closed,way impressed came together suppose felt like fate effort though series coincidence forced u consider prospect somewhat
ENTJ,laying bed forever make feel like complete loser turn autopilot mode instead get thing done deal frustrating mistake,okay know,stupid self doubt insecurity secretly killing said,like everyone already implied mbti thought process environmental influence however give different flavor manifest cognitive process,actually pretty common s avoid people since dominant function really relating people traditional sense way express extroverted tendency,think wrote really help narrowing type really talk broad manner expect people help find type asked,know lack social skill desire external power grew circumstance developed social anxiety however working building confidence extroverted,,interesting many people accept extjs still nice kind gentle time imo type see sweetest loving,score care fairness loyalty authority purity liberty strongest moral foundation fairness morality closest,got,type tritype interesting took got type tritype identify,perc,planning take business management administration,planning take business path however math good worry formula finding area perimeter triangle rectangle factoring,silly lol literally feeling le intelligent actually,happy af,alright another day another chance change,,worn,hmm compassion kindness needed however kindness given point spoiling someone type kindness one help people self growth,welcome kogamori wondering long take find type sure easy read lot introspect lot could conclude,hey welcome good information knowledge sharing community,hello welcome hope enjoy stay far type concerned lot people get confused justify type saying oh,gender female age intelligence superior openness early adopter mbti personality profile closest alternative found lol starting age already messed p,want emotional connection want acknowledgement especially person know confused really know exactly want,realized ignoring really mean solving ignored big hole heart tried forgetting know puzzle piece fit right find,okay know mean reasonable fine people wrong something obviously know nothing happy,would rather say code geass avatar rather anime really fan anime general find interesting unless something specifically find interesting,drunk parrot tired forever questioning settle see happens enneagram kinda messed,well typless good amount time asked helped typing self awareness trash feeling care sense world think,teenager weird really weird,feel like lost lot thing mattered lot give effort keeping,may almost similar value one integrity sincerity trust loyalty,okay actually really frustrated feel worthless stupid,think annoyed,overloaded thought world,actually try think possibility deduction method come best one fast brainstorming basis idea refine,kitty ok trust post time think go although still sure ne ni se,guess figure first prefer te ti kinda tricky seem switch also talk p j point like te like organizing thing,read first link see acting inferior se si fi fe although much si thing agree always feel like bad thing,requesting prayer peace mind clarity lately dealing lot mental abstract stuff including believe really strong believer,full frustration,bump also hoping jinsei see,really bad come typical socialization every time engage conversation start talking thing people interested start talking,kitty thanks sharing analysis thing said somehow surprising never thought especially fe scenario one never thought,would mind telling got conclusion somehow confused seem like introvert many people know introvert lot,likely look obviously outwardly jealous exfj course stereotype,think finally settled good state mind unlike lot thing happened wanna try one time see thing work time,let say accidentally exposed personal secret mine classmate really stupid
