ENTJ,skill say truth emphasize good part like balanced scale provide side smart way feel honest way almost,many hobby see rounding attribute self sport game study journey clubbing even period finance related activity hobby,read first make fun turn goofy good mood laugh first subtle quite distinct attribute enjoy mocking,fixed laughing pass thanks,yay sigh tongue,win laughing,xd true think u figured look matter want play game,get get iirc pic slightest problem getting one,twin agree experience exact forced cuddly duty anguish tell horrible people herpes excessive acne etcetc,two s make good friend always essential thing long term relationship kind also generally good looking first attraction would,cringed reading uncomfortable truth relate walking along seems generic truth think type seeing way,think term te ti dissect form course understanding opinion feel either basic emotion via intuition like th sense sense feel stock go,studied music pretty much like anything else one checked box list thing know skill physical one long thin finger tehehe teacher drool,hahahahah xdd,serena van der woodsen gossip girl lame posture deficiency,meanwhile consider get direct monetary return currently networking send press note relevant online magazine make aware work may,laughing feel u powerfully hurt u differs,hahaha thanks correcting,fitting,think many even understand distinction,hard read understand whole post pitiful accusing lying merely understand,purposely however noticing month people driven away forum poster intimidated silence interest say whatsoever,still get trouble unless people get retort even better even non nt sarcasm seen retorting biting level irony,life full question dry,hon tested wrong like fact wrong want tested experience told,valuable input hm difference often subtle offer small detail rl encounter say like pol magnet way field vector,disdainful superior typed point word word debo understand tried urge stand wrote earlier though disagree,see want see sadly see amount much know reply fully yes obvious obvious miss fact almost,come saying opposite amuse way feel attracted pop quote almost anything say sadly often irrelevant content,like say cuddly cute sweet idealistic stuff cold fact measure success one factor achievement le glorious child victory,sure socialism communism one best mechanism maintain protect capitalism high school material rly dry brings piss history,understand upset agree general idea go calling sour grape failed may fail consider whole response targeted specific aspect,happen situation suggest make dare thing unless like idea btw title cute sexy op hon sexy,smart even brilliant go research market similar apps see already done extend great potential thank stop advertising want,hm care lead care lead well get annoyed act upon,iseewhatyoudidthere ninja,char,see consider normally usually perhaps normally mean normal mother nature seems think differently normal see worldwide life span data sayin,deep ice mining job manufacturing business future weather control technician banker lawyer still exist cockroach pun pun,doubt also persuade explain besides distracted still laughing post xdd,speechless chosen example laughing quietly thumb,expected get joke original post never warranted taken seriously counter norm argument expected fact known anyone eye look around,ditto well put,genetics fact mood,since older one male hon wink,hahahah fine,care punctuality unless external factor dictate plane taking arrive example first impression count almost always,wrong know wrong would flooded exclamation mark laughing,thank captain obvious exclamation mark seems like got excited even thought,coolfactor every time guy somehow always guy say stuff like stare turn pink say apologizing evading joke
ENTJ,dear sense humor miss much even funny sincerely help,actually got bed better yesterday,,called intimidating umpteenth time,wish could kind person want anyone else,atypeofuser know mean used active university began thing seemed important answer question last several month,,dear mr gatsby thank providing great idea drinking game sincerely old sport take shot,fi inferior problem,,,,grew muslim household although particularly religious typically participate ramadan fasting answer question allowed miss one day,,,,,,,course others looked sure saw strength endurance ability overcome anything point time really feel strong realize patience,,warning long post ahead read absolutely curious development someone triple competency tritype nothing thread meant seen,,mimic everyone else thread lgbtq forum sound like wonderful idea always slightly conflicted find thread made user discussing sexuality gender,,indicator embody arbitrary stereotype pertaining type categorize others based corresponding stereotype outright dismiss possibility,,want,,sp sx,sex postponable think overrated think important often mind flooded many thought thing past present future sex,going back gym long break,noticed mushr often wind side argument distinct way expressing always admired greatly best remain,well always seem perhaps merit idea pairing,see turtle cute carry home around everywhere go outlive many animal human alike make awkward high pitched noise fuck,travel back th century victorian england take turn around garden steal kiss one looking,snowbell remarkably good taste avatar incredibly intelligent willing listen inclined bettering quality make glad one,thought would post well cheer,welcome perc mention specifically introversion impede ability become successful wrong two way mistake disinclination introversion,die hard apt title depicting precisely happens dragged theater watch,know kito practically friendless reached university level entered college thrown diverse pool people walk life encountered handful,feeling lately chasing possible book idea,absolutely welcome please feel free contact convenience pm time surely respond good luck,jung one,know pleased find someone inclined undergo change growth many dismiss idea consciously tending shortcoming embracing better quality,long refers controlling snide people general merely sjs agree people exist hell even mother way part hate,well done glad see difference sjs plain control freak though sjs complete control freak others way toward holding,real life experience seems led people pushy general never know sjs might pushy distasteful way presume much,oh would lot better end looking like bigoted asshole others cared say think bigoted asshole point think,hate get nowhere yet another prime example people use u versus attitude rationalize unwarranted hatred justifiable would hate
ENTJ,prepare gene gene set activation sector protocol initiated prepare head anarcho capitalism self defense dream,never became one philosophical lead led narcissism simply ask save world cost small personal sacrifice one know useless,think s prone bias certainly run consider rd buffer matter consistent complete hypothesis world created take position,people practice impartiality wide skepticism strong guarantee one way regard critical thinking find political junky run,maybe stefan molyneux alive,would chance atlas shrugged type master plan scenario hide everything hide big terrorist gov incoming happen plan except came,understanding sufficient enough efficient probability action acquiring understanding preferable staring aquarium initializing ni unknown disturbance snip,disable email notification wan tot notified email reply quote answer thread,right right composite ginormous pile shit everything directly hated got nothing hide hide believe people,green pink purple orange care red white blue tank red white green sniper,tell almost straight give bullshit seek truth seek reason act somehow live dimension seems somehow pink elephant teleport like,holy shit let run project told member team let would best everyone told look run show letting run like,word fix trauma,hypothesize adhd psychological phisological first premis true proceed hypothesize mindfulness mastery mind cure addicted,go ritalin bullshit high estimate physiological genetics even consider bloating uncertain crap point want action,answer feel unintelligent know lack intelligence true uncertain thing outside mathematics everything logical empirical experience tell,euthanasia let absurd absolutist fear mongering stop choice,share information idea others share see learn response learn hehe basically reason someone wanted,best productivity perspective plus almsot link esoteric speculation think se also least speculate cessation,externalize putting exterior world,know chart answered perhaps chakra chart google chakras image speculation scientific people mind thing,lacking self knowledge understood part could part thing confused others also identify fi user general core principle understanding never,happy content life moment unhapiness x hapiness x x grand value self esteem teenager imperfection physical,ha piece cake give relevant cue try working premis soul mind like body like muscle instantly stop,especially philosophy dedicated thought system irrational religious zealot go nut find scientist actually speculates lol,fi te hello would like exchange idea information agree participate calculates utility accepts accept may insert fi ni,could get esoterism perhaps higher level consciousness atleast lvl third eye vision chakra related ni tap higher frequency,well perceiving function subconscious ne ni se function bigger wider proportion subconscious ne reacts creative demand good,vague lock onto one semantic think feeling mean action thinking feeling b action discarding whatever mere invalid feeling,best believe best productive valuable clarify concise thinking part mind seem trustworthy lack brain power processing capacity,thinking user could share rational oblivious convince assuming open come understanding thing ni believe throwing,philosophy defined moral code self knowledge organized thinking avoid inconsistency value non maximized decision mistake first thought,never settle anything permanently,found going make thread l post since thread already exists amazing ability,yes obviously sometimes interesting importantly want miss gem,seemed useless efficiency position,ah thinking intuition mental process unfortunately help gut neuron hahaha intuition something use focus mastery,see devil advocate clear wish would mainly many reason could like negative involve insanity,easy actually know engage auxiliary massive thing ni leader work take try use,say want talk someone consider bring subject knowledgeable friend subject favorable unfavorable discus type starting,problem angry carry angry baggage like comfortable option case want kick evil as head celebration know thyself express,fe ti p value correlate openess polymarous relationship take promiscuity take another direction ne se high stack also correlate,perceiver fe ti higher chance astounded mutual two way correlation function stack mbti r k epigenetical theory politics,could check r k epigenetical theory turn k rather malleable observation gene set genetical database,inner circle great lover equal external circle good civilization opposed insane delusional evil mess introspective feeling estimation want,researcher would learn past discovery get database see new frontier make theory participation feeling people use discovery,wish history followed principle science theory better explaining reality replace previous entire thing history shoved,medium female complete asshole patriarch wonder le men marry,associated s least met ideal high expectation think worthwhile meet one ahs link life perhaps business secret,met sad seeing nikola tesla elon musk close got meeting one enough idea type rather think s best actually subtly yearning
ENTJ,e type sandra maitri like book,think sweet lovely e lol,good song brilliant boring type,sexy care type,,could,kidding damn smart rational logical course extrovert,yes could type sx favorite new album,oh like sevenish side happy,hello calling tritype ambassador let two thing fun post picture best describes song start,,think type type eii could iee ile,said enneagram song boring show w good song like boring lullaby laughing,think,torus amos goddess definitely,,barney obvious,maybe,think,hi mean data russia definitely eii socionics type defined famous russian socionics psychologist consultation,think sting nf least nt according biography romantic distanced nature likely p sure happy p lsi socionics mbti,right reinin dichotomy working thing noting common nonsense happy could easily prove opportunity observe real life,ok studying socionics year really lot say poor english stop right say socionics developed far since time,satisfied theory comparing mbti socionics would noted main thing mean thing explains skeptical mbti,ok mind happy prefer mbti socionics principle going respond friend request,laughing,thank happy,look like really mbti socionics,vaan thanks,oops seems like socionics mbti tried mbti test say,oh really cool inspired original idea good happy,interested information,recommend,thanks lot traveled almost whole europe moscow feel home,one favorite book rather cruel describes people violent character time amazingly interesting personality looking forward,welcome forum happy,hello nice meet,hi think great taste art nice meet,nice meet wink,welcome forum laughing,black swan scoop true grit eye wide shut fight club lock stock two smoking barrel l instinct de mort,laughing nice meet laughing,skycloud thanks,congratulation great p according socionics good combination,oh nuance currently existing russian socionic test extremely imperfect mostly result indicate type want appear type think rarely,darklyvalentine oh like true blood californication,russia typology called socioni first glance similar mbti many fundamental difference typology typology rather,intricate mystic vaan lullabyblossom vellocent thank suburbanlurker spasibo krisp hi moscow heat c f rain thunderstorm p sorry,hi everyone moscow happy nice meet,hello everybody moscow sorry bad english cool site pleased know love geoffrey chaucer emily bronte pleased consider
ENTJ,lol well fun,wish chat room get bored night never sleep,knock page paper one night scratch reply soon maybe help procrastinating,great literally crime girlfriend right lack option cant seem attract anything better sort relationship outside,got real gay real fast,homo think found guy might better looking,like sugar tit,hahahahahahahahaha hahahah yes except straight,lol seizure watch gif much,greatness always,gonna leave cause like guy,warrrrg depressing week great thing happening anyone celebrate thing lately roller coaster suck ball,loneliness painful human experience overcome much stronger,try find preventative health doctor specialist help set diet keep really healthy etc spend good bit extra food get,think finally know want date mutual live far apart hope relationship really great,man fuck life promising date really sound like doesnt want second one suppose others pretty rare lately,people probably think dick wait ha,want pilot license yesterday want girlfriend leave alone time love sex much like job enjoy really much,lol,date really awesome friday,beat lazy,talked adorable blonde girl today double major micro biology something else anyway intimidate fuck life thought cute neighbor though,learning fly kind pain as finding right instructor whatnot,airplane acquired,getting fucking airplane dont tell s lose shit,dont weak,good quality woman everywhere seem make work dont fucking know really care anymore,know ever want married also unrealistic goal human being much used tired alone constantly surrounded quality,night guy arent attractive whatever reason fml hate super drunk contributed anyway tired single,college unless getting technical degree long go somewhere better community college matter score get full ride good school,met someone special year ago talked skyped every day month lost contact year later found look like picking,yep,hello friend question like party bar recently really shied away whole scene like tonight literally stayed home,sensitive much damn lol,thats hide crazy late ivedatedthatchickbefore,accurate experience,damn get kinda rowdy eh,haha,ever bragging people assumed insecure regardless posting worry,waaaarrrg money wtf rich po bet didnt earn,hey sent message like day ago,mentioned money lounge like freaked immediately started spewing hate wtf wrong people money make lose mind,ashton kutcher acceptance speech teen choice award high quality youtube im gonna leave,god time see never,study know unless law make good grade,drive z nissan friggin fantastic deal cash engine put infinity k le price tag besides buying nd car drove busted,really care impressed pissed poor drive horse billion dollar think phaggot take advice deal issue stop annoying,graduated yet time graduate master industrial engineering undergrad environmental political science wont write whole resume quite,probably buy used one low milage depends market pretty close truth trust fund sizeable debt figure salary,hey look guy found hater cool bro hate honda day
ENTJ,hi material answer speculate cognitive function great going stop definitely sound like introverted attitude especially fi,maintain opinion tj really free believe anything like think would benefit greatly studying function profile typical behaviour associated,hi really understanding people pointed towards tp preference sound like place te fi axis would like make case,sound like te dominant seem needing te cognitive need logical external structure apply systematically make decision effective way,think alternative telling function one may using test mostly based stereotyped typical regular behaviour assuming people use two,thought ne se extraverted function look interact many possibility world focussed multiplicity choice hand,crownclown let go typing behaviour focus cognitive function need push personally lot stereotyping trait aimed figuring,prada agree purpose mbti least see bigger application potential rather putting people behind behaviour stereotype classifying agree,intuition concurr add seem better handle te fi dynamic handling tertiary easier thinking le touch,yes tricky onpoint analysis matter take work pick piece articulate precise clear order convey famous gut,duality express personality reveals main conflict two four function judging one show evidence ti fe dynamic desire keep detached,thread put accent controlling behaviour telling u much need control thing exactly could unhealthy behaviour fi grip needing,elaborate need,display quick reaction environment se envision possibility probability ti realm need right going car,hello hello welcome perc also lot lurking actually plunging forum hope find info satisfied curiositiy judging function first,picking si ne thread reflects narration content showing come cognitive function personally go,compulsiverambler interesting correlate reserved intellect rather giving impression intellectual understand stating fact,gambino higher thinking function mean ready share feeling suddenly machine understood difference cognitives,gambino realy wonder nobody yet answered post day already give opinion maybe start displaying,purpleviolet give food thought post go really enjoy ne gone doubting sent back careful reading post admit,happened last thread told somehow got interpreted along way head reminded upon place good bad,given piece advice perhaps complains paying attention thing mean actually need validated put,ti fe fe ti dynamic perceives others put preference forefront usualy te fi fi te selfish whereas focussed keeping overall harmony,absolutely zero information cognitive reasoning come make decision judging function f neither collect data make decision,fi te work likely cognitive order find clue fi internal like keep quirk private oneself taking action,focus reason judgement situation tell like like person may happen based many reason according mbti rooted,focus much behaviour mbti behaviour reasoning come make decision basically presenting,without well thoughtout list idea exactly need end buying thing strike fancy like oh like could want perhaps could oh,making sense exposing use fi te still entirely convinced seem look function work together perceiving judging seem really,question really whether shouldor type people like necessary purpose serving honestly range seeing,ti fe ti fe lower fe want reaffirmed looked validated craves part group supposedly higher ti cognitive function need detachment,many thing annoy trouble spot oversimplification problem hand explained something intricate refined way pressured make,mbti way improve understanding world several language improving skill sort creative,would love free help think people actually wrote book took time earned right make living writing others also working,simultaneously annoyed behaviour aimed fitting help unconsciously seek fit,confusing behaviour motif mbti theory behaviour come behaviour people dreamy several reason people may like many,short making lot behaviour cognitive need cognitive process decision making process lead given perception world,hate tradition like education passed kind tradition disliked always kind rebelled really want family nurture rather personal,although alternative kept nagging enquired little funkymbtifiction lot information loop hyperactive,took test sticky note section scenario thing help also pondered lot upon te actually done reading,insightful creative way putting like truly resonated thank sharing insight,much food thought go another sunday afternoon spent researching went back enneagramm theory well complementary way explain complexity,mmhmh still know hard time knowing sure comparing example people already profusely read celebritytype seem get much satisfaction,hello alternatively typed come believe ne dom without doubt still questionning whether fi ti user,okay thank dig little fese loop better access ni thank much,hi sorry abroad access internet xyra last post seemed unfinished troubling seem know lot typing people stop,masamune yes intention describe say foundation future say vizualize compulsively going navigate,eggsies alright well maybe perhaps could describe feel function work together understand better read profusely function supposed work,radu actually took test several time find result consistent decided use function precise actually deepen perception system,hi trying type wondered could give hand know use fe dominant function know use ti minor function
ENTJ,self centered moody lazy envious materialistic ummm think bulk,yes lol,hate label feel extremely limiting restricting feel somebody label something putting limit potential put box,sound like,tip wait get paid spend money lush produuuuuccccctsssss ugghhh seriously love bath body product,good hand job work really quickly come shipment gripping hanger sensoring clothing etc etc wish realized good working hand,think ever gotten mbti quiz usually score sort intuitive member forum type say se,find new type,really love think amazing really great job op,feel empty lost supposed,hmmm maybe hell gain different perspective,really sure numerical rating would say ok time totally oblivious self absorbed mean know serious,want canon rebel damn bad current wishli ht includes black white pair nike roshe black white pair nike free run beat headphone mac book,kept meaning post thread lovely idea kept forgetting tongue anywhoodle accepting others encouraging supportive like,yes mainly work persona different really work like giant wall go come cold distant think,house day driving mad mad mad mad mad need new experience life get shit done home believe took year figure,force write daily feel urge,find asking question daily sometimes think may rational type always trying find point need everything make sense anyone else like,procrastination laziness self doubt moodiness,death character important main character bear,diary sort kind thing find writing keeping journal diary past year many filled,coffee bitter gross always feel like drawing never know draw time growse da,pretty slow paced like others said reflects easy going style feel like need better topic discussion create thread,slytherin,ty opposed got fe j si rather,read part woman even though finish liked enough read quote though one favorite,sushi regret nothing,warm fuzzy blanket,food food food yes please really cook shit think really good palette whenever go dinner people always tell make really good food choice love,chicken cordon bleu sub really want sushi,sure,sound pretty fi driven,came across description yesterday thought pretty good unfortunately another look description member,worst part,think really good breaking thing analyzing summarizing kinda fun,oops never answered um uh know got yellow first time took remember secondary shrug think might like magenta indigo lavender something,someday get better promise,today yesterday work talking briefly customer told enjoyed meeting good energy absolutely love people compliment,thanks guy help going explore bit thinking might enneagram w hmm,mind thanks asking happy working getting new job getting back school changing career plan rebuilding relationship god took,hide good reason spent last week working towards goal boom matter two day came crumbling taking break life wallowing,depressed day,hi guy exploring socionics land thinking might iei translates mbti made typing thread day ago one replied lol,,vivid melody vision board beautiful get image,,hi everyone second shot typing thread one year back response received stuck typing,hi guy lurking amongst s something come across researching type concept known inner vision wanted know,enjoyed lot thank posting stilldaydreaming,hi recently ventured land socionics bum bum bum really opened eye opened eye much may even actually made come
