ENTJ,question dealt anxiety depression abusive relationship stuck abusive relationship six year several life changing event,efficiency cleanliness dancing human connection,find alcohol answer emotion sometimes help take edge anxiety,video game reading bread butter worry mbti defining hobby mbti go something love hobby,would say find many place depends enneagram type likely networking event type networking worst,aboard high standard sky limit laughing,high standard likely name spaceship,yes insofar effectively business partner well able take case something happens u relinquish control easily get,personally vendetta s mostly due abusive relationship manipulative deranged best advice approach,never romantic relationship strong friendship coworker anchor storm lot time however amicability,looking book process read ender game crack,usually monster right need alone swing pendulum issue really fully aware hatred anyone everyone dare require,yeah still stuck op well dating hard unfulfilling granted go big go home philosophy tend jump straight one serious relationship next,yeah still stuck op well dating hard unfulfilling granted go big go home philosophy tend jump straight one serious relationship next,feeling birthday like center attention love celebrating mine situation think nice way start work week surprise party,depends chemistry b english ed teach sophomore english younger answer would find office working,find mbti useful take gospel tool someone something rather however teacher useful able determine,name amazing place ever traveled would like go yet uk japan tell u one thing fit,actually also mbti socionics know personally drained f type matter sf nf,feeling s best summed photo though admittedly experience limited past abusive relationship,anxiety self esteem issue well echo others already said however come enneagram mbti type driven extreme,,siamese kitten four month old time post named chess black white calculated move part adopted rather nasty breakup final insult,removed toxic relationship much sensitive recognizing sf type staying hell away circling,would get blunt aware emotion hand professional problem hammered public emotion involved significantly,one another find time place area wait staring make come motion pull side room flat ask,would disagree hold grudge like bos might see sure trait common s although common know personally,conflict seems happen primarily personal level deal type professional level teacher issue came personal,describe broken b internet troll act around grrhisspfft b amused banter usually take place although know,definitely flash temper however learned nurture fi year generally much controlled response allows human,speaking thing really made jump relationship order get rut idea someone providing resource decent conversation new experience,alarmingly accurate six year starting realize keeping unintentionally shadow form time intend discus,next question deal sfs extreme amount stress almost totally point shadow form teaching,usually try however situation buffer person failed left feeling jilted floundering consequently angry,would suggest interact seems rude say kind coming want starve either side pleasure,going,suppose j function rearing ugly head deciding people waste time huh starting seem way longer calm,rather uncertain time life shrinking away people initially trust feel like waste time almost taken label shy,make sound easy sigh worse sure right patience level allow type topic searching conversation stress,boyfriend decides introduce someone new sake integrating part life required,seem limit contact everywhere help high school teacher inundated sfs,yes nt nfs hang balance surround work home dating sf first place would million dollar question,nevermind figured think section show,definitely feel way socialize like beast anyone anybody long endgame need something people teach something talk,discus minute observe interacting others usually deep conversation flit person person,problem sfs fps curious kind issue,sure respond image divert question get mbti type underneath username sidebar,cricket,either never played pokemon,change get older going thing well college find person small group accept class completely
ENTJ,think looking affirmation like someone know gay like type wonder homosexual also possibility,say let try initiate something especially involves kind manipulation make worse get along stjs okay level outside family,unless shovel body bag handy one night come,remember identity issue properly describe feeling anyway personality expressing fullest,matter first sure first old right seems like want relationship s tend,direct best way talk personally hate indirect annoying waste time could get need indirect direct,people see intimidating understand,love idea debate reason mentioned msbossypants others however people purely piss notably sfjs seemingly believe fact s,bet claw deep skin cool,interesting talk longer minute hit conversation pointless last minute gonna change solution,used bit shy talking girl anymore,rare remember last time full tear something made eye water couple movie maybe song two certain circumstance news never someone,lol quite thread past first page first page generally get annoyed s generally get annoyed basically trying piss,,already done thing list work feel like want something tangible real something read hear much prior feeling way,think hate yes s sure one actually share something time time look surface,speaking yesterday going many great little thing thought matter last long nobody remembers,known one month situation another one year situation another known probably month situation go unless shell decade thick,sound almost exactly like happens time time couch thought also quite much control future felt like reading something,definitely agreed s finally s seem kinda dull time rarely entertaining conversation one becomes boring rather quickly,well maybe much giving losing excitement something close hard explain really quite ironic isxjs actually complain yet say,whole life expressed annoyance short term situation waiting counter example change nothing impatient time situation,hell raw eats tomato butter wtf,laughing friend like attention span cat easily distracted anything everything make crazy quote oh hell hate people like,gonna provide sharp weapon coming take care people like,joking part yes sometimes people even see behavior condescending get joking fun,sense sarcasm people seem think s expressive expressive actually heard people telling today read another thread,people complain tired every single day care tired past month job hard cool mean gotta cry every single day,sure sometimes call spontaneous thing sound like something solve instead putting,fe vampire actually said today awkwardly faking smile two getting along year looong time look tired,talk gesture face tone voice,awww thanks vouching haha ah wanna hog em eh hehe,messaged people let know anyone else interested,sarahbrave indeed thank answer great read evening,belligerent hostile mean never come hostile people tell come nice yet aggressive,think aggressive get told general demeanor aggressive way express know personally see s much aggressive,sound bit like kazoz least like anyway s seem warm easy talk seem genuinely interested say like one one,bumping case someone missed post since one person expressed actual interest pm,find s really cool least little exposure compared type especially real life cool part always talking,would make happy mood maybe get mood first place sound almost sad hehe,well else supposed say wanna talk s mind incapable working another efficient rational solution shocked sure,would like get know s personal manner forum post voice conversation let know recording sort interested,sound like choose people get clingy really carefully get clingy one actually form bond hope,s seem read noticed clingy get attacked someone example know s unable get ex long time,weirdly enough people tell,kazoz really surprised s people oriented,self explanatory would feel like enjoy every moment every day necessarily mean long term bet traveling move meeting lot,thou shalt express idea action regardless others may think,nighty goal necessarily people oriented,sounded like p j play content good enjoyable
ENTJ,fuck television,actually find article instinct forum,contemplated suicide reading cookie game kid cousin know name called thursday,like said raping someone basement like ordinary thing obviously laundry first rape someone basement clothes fresh,erm surprised mention sex yet without partner fair game well,omg deliciously evil,claw mark make tunafish cake assuming pound tuna well,would think sp feel like sx need development see secondary instinct supporting instinct first instinct feel like second,huzzah,literally reasoning honest sure luffy sx dom dom sx dom could see without doubt dom could see,competition hate dynamic fit personality type unless dom case would likely,swordsman mana throw vegeta sx well goku sx luffy naruto,love love wanna fuck er mean tea together,oy everyone read maladaptive daydreaming mental illness extension creative mind earth psyche happy happy happy happy laughing,year man sometimes share people knew guy girlfriend never saw old couple car freaky yeah think,think meditate meditate meditate eat broccoli chicken soup meditate,actually think last loneliest sx energy get connection others reflect,graduate student master degree psychology fyi confirm truth statement better swagger higher rating,beware sx new ebola,sometimes wonder ultimately learned accept overly concerned material financial welfare like sp doms big fan networking,tch without doubt say w w w sx tritype,different culture different norm different mindset,making joke cuz timeless mod,lol wanted hear side note nobody else laughing as vacuum cleaner distributor called kirby,nah sexist pretty sure woman think lot,think quest true love riddled pain walking thorn long time get enjoy rose personally think easier relationship someone,think reddit really defined culture sure majority culture culture perceive majority entirety reddit alot,like plotting destroy mind intelligence woman really good,wow woman really know woman better men,yeah give one last go move forever,omigod iloveyou please marry im going pm month,ebook free review,,yes accountability get respect also love killing people,put ne work figure clever thing say break ice always work woman love fun,yeah kill people burn shit fuck school,thought something nice guy walk bar notice bar stool left another man walk bar start walk since bar stool first man offer,erm like ask instead using mbti wipe sweat sweaty palm think thinking circumstance way much say,nah drive bimmers yo,people interested personality awesome interested personality people happen interested thing interested godlike mind,super nice person first thing first really nice everyone pretty pathetic annoying nice everyone expect people respect,one p,would love make game actually listed one personal project life coding experience shit ton idea actually thinking action rpg,,want user thought also thinking taking course action,wiki walking,like library,know wandered thread bigotry sense went,feel like understand sj think need said person lacking intelligence sj sj smart honestly pretty complex,sound like load bullshit mean look profile figured everything needed know picture avatar profile
ENTJ,understand new people little knowledge think able type think cognitive function take age get good handle,understand new people little knowledge think able type think cognitive function take age get good handle,friend studied lot mbti thought maybe um nope def bunch people neatly fit type necessarily eg due appearance,funny woke early life could gone done good job becoming manager already completely guess enjoyment phil,yep need stop depreciating self bunch seem soon sorry delay making new thread guy big one kinda tired last,thank great reply come post next thread,stop modest nothing say answer suck add anything go make lot interesting point discussion various topic thought sheesh look,lol like post new thread hour wait til p making another post thread talk interesting stuff,guy going start new thread could reply value self doubt direction specifically talk odds end cheer,well put apply different advice bluntness straight forwardness overly worry much hurting come across f naturally far le,following vein recent post finally decided get writing post mind occasionally stalk pcafe scholar infx please,maybe assumed offended acted like offended whoa first claim make first reply appears taken offence,excuse intuitive slant topic since already started controversial topic elsewhere sorry read horribly scrambled post fact lot others,reserve,hi guy right idea start bullshit thread go anyway ix rather interesting snowflake case please read post something would appreciate,deal f whole lot heh everything needing warped layer blanket hot water bottle immature f blanket,score primary psychopathy calculated primary psychopathy affective aspect psychopathy lack empathy people tolerance antisocial,sorry p seems serious fairly honest whole time torn love get hurt relationship,gf month jsut advice experience may may valid read trying read nothing,wonder feeling particularly strong maybe population feel way really detest limp dick hand shake good way instantly drop level,yes wana able respect opinion person regarding banter banter back call sht banter mean sexist sure else put,insult playful way might well like bit immature take grain salt pay attention time talk energetically,deee scuss p want much criticism video sure super air tight discussion idea point,think fe particularly correlated loyalty compared function may wrong though pretty dam loyal think,lol thinking reading thread even know would answer question read efficiently navigating traffic making green true ok,listen young whipper snapper u still living student money eg fuck fair whack got restrain max one day send big later,let save time excruciation much look talking sound arrogance talk sound like feel,god annoying stuff say fine holy fuck,joking sorry stop nice pc lol,henceyou find youself woo lah problem solved,click bait wanted come say one thing like sometimes go ahead ask people question section confused eg v f,true though even shit time good space still really high standard heh,c get really hot running matter temp,ring true really make obvious serious want stop really obvious,kill thread posting confused shocked talk lady dude shall heap forth praise tibet gobble,aware feel discus come arrangement deal,going beat around bush sugar coat maybe reason feel think making huge generalization might somewhere wrong view maybe,sound nice softer sibling younger sister think made argumentative hehe,like lot dark stuff going get back month way beer also forget squeeze little happiness,track chat little get warmed stalk bitch irl find powerful grappling gun commandeer spaceship,older year spread u first born get testosterone something study done,bring please,sorry eloquently done excellent grammar anyway believe one mentioned yet shocked really speak,sweet guy review going biggest fragrance explosion ever weird think liquid dry second chemical process hand,interesting added fragrance according review idiot lol,rock climb tell liquid chalk speak,like say yes grammar sentence structure shit fucked making mini essay every comment also feeler putting every comment layer blanket,stiletto could give u opinion sophia comment since experience situation,interesting thread let mention couple way might able get idea whether lean e bit different spin suggested far feel,good mature sweet think still get little annoyed rulez must followed general analness hopefully much dealing
ENTJ,s s definitely s would piss s would make vomit blood would frustrate s deep s annoying rest matter,say,relationship question felt deserved thread pretty straight forward question break someone something said particular way,hold horse,pushover,done law degree met best friend going litigation like way becoming diplomat honest,physical trait generally go look definitely important assessing someone interest regular man would fine good hygiene,hmm would attract mom one best friend male never attracted would strong,going relationship think think able benefit relationship honestly fine,agree ellistra said overly praise view genuine like forced like something feel cheer motivate,may answer would easier extrovert find s imo uncommon bound one one many group,wear heart sleeve hardest figure often denial anyway,guess share typical pov one maybe fact date think end goal yet life partner,invisibility time travel super human endurance,haha know sometimes heart reason reason know nothing,identify frustration would think assume well sure reading tumblr might really awkward find,yes completely agree one student sit hour long lecture listening someone boring enough top start,huge crowd walking quite narrow lane couple hawker side people literally stop abruptly front check whatever sold making,plan next trip next course action might seem stressful type actually find calming knowing,truth told trying get hand quite year maybe never met one immediate circle anyway saying lot since always get,would never say intimidating probably s s quite easy gloss ignore sitting quietly listening might weird try,honestly female befriended female s uni rare specie dare say easy identify female s real life specially,x talking x tell latest failure say stupid x try justify raise eyebrow x mumble yeah,seen various input seems taken decision already even told yet seems leaning towards give try,thank reply really appreciate think expectation worry one side expect lot side work,started seeing week ago acquaintance year turn personality great match value principle logical way,,well year two ago watch tv series much,oh right let clarify partner going away month probably coming back month going back another month coming back good,s take ldr guy think could possibly go,thank replying long known dating may ask wondering maybe type s pro commitment rather opposite,ahoy started seeing type taking thing slow seems want go everyday thought guy liked alone time anything,year later still trying figure enneagram lol tested going taking couple test guess seen many type s around,score possible,asks way many question would make statement back fact would shoot question mess,tmlt best relationship parent,melancholy choleric sanguine melancholy choleric phlegmatic,real question would want good absolutely everything would waste time really value time,type make feel,,give s cool,action component gamers high action score aggressive like jump fray surrounded dramatic visuals effect gamers low action score prefer,friend mostly s family guess come also slight preference extroversion introversion could pretty much qualift,nopes like like people touch would touch others lol,playful word yes face face,become organised driven focused better completing goal think start looking difference see need done,feel relationship going anywhere let person know directly would straightforward matter factly would still tactful careful,nopes never fallen love know want fall love made theory say inverse true dont worry know theory flawed,depends fellow much lot fun let tell,coincidence perhaps posted something social medium person friend list saw decided get back touch think weirdest
ENTJ,myth fp type incessantly bad money myth tj type intellectual bully reactionary e unhealthy fp tend horrible money,great subject attached interesting reading subject retire wealthy,thanks experience student especially female student whose ness odds aspect culture best gpa typically brilliant,remember reaction crazy,lol laughing two sooooo alike cool,inconsistency perhaps personality love chick flick generally dragging wife one way around,laughing laughing laughing laughing laughing,yeah laughed u hour looked ex nearly rolling floor lol remember difference made prof took personal,literally someone fan scored ayn rand philosophy test floating around must admit find disturbing wonderful,stumbled across typical personality type hilarious laughing,semi random amazon wish list,bad tongue mind point story story blushed come appropriate punishment kitteh,theboss posted bighug forbidden goodness could flirt one mine,well already fan sovereign seem concise penetrating clarity many subject love woman let say dramatic effect love,strong e moderate f think conditioned real f much stronger probably somewhat repressed time recently first met,msbossypants say true use type micro predict behavior think could said reasonable certainty limit emotional fusing almost certainly,get surprised pair loubotin christmas oh bought new dream closet solution yesterday organized well girl thread,profound found called fault usually merely excessive portion strength developing balance temperance life without sacrificing passion go,remember different especially thing like level extroversion level intuition level thinking correlate wide deviation among u also magnitude,problem saffron thank excellent mediator highly extroverted one suspect conflict painful,lovely n dej even like look flaw since flaw way nature produced u like view variation expected value,video fascinating illuminating great speaker one tell battery draining video progress great insight introversion introvert power,much truth called mastermind nothing,laughing laughing laughing laughing laughing laughing lol know never happened blunt offensive might think african american student flocked,idea would feel like live life another person willfully purposefully lobotomize one self process suspect result criticized,yeah lol funny thought quoting typo suppose hoe economics would likewise incorporate ebonics lesson give idea new course,yeah thinking celebrity find work squeeze one last drop near spent credibility last ditch effort find credibility work,depends define unintentional mean literally way unintentional disagree mean awareness perhaps someone might offended agree reasoning,yes actually ocd efficiency complex thing lol crazy,indeed thank pointing emperor naked owe fruit tongue yes rarely philosophically despise might called altruist,use car rather automobile rational rather logo yes speaker accountable word choice likewise receiver accountable particular word,engage offense person made emotional attack idea statement drug wife issue way sounded invidious,said previously realized type wife informed home economics intended mother wife garden utensil see taken,agree emphatically thank summarizes well balance required human interaction day conversation feeler concept abating,ok see coming either outsources sex though definition commodity outsourced love impossible transcript entire conversation,noticed lot like faery cool,lol yeah bit also wife essentially met idea discussion second met chatting storm stayed,wow awesome need day ingest properly think much say ask thank,really like mean really saying dr phil always done get always got something working stop,paragraph one thank claim normal relational instance also use word selfish different way many people would might first find,leasantlybrainy actually belittled one hand made purpose search post engage intellectual discussion go deep,j partner begin subtract minute every appointment time give,know mean paradox strong j help plow thing laser beam required also constrains world sort myopic vision,strongly think human requires growth self awareness born equal science make clear many personality trait hard wired u birth,hellen fisher argues work best statistical bet argues sj people romantically flock together also belief e insignificant something,wow thanks profound stimulated brain along cup morning coffee,absolutely purposeful arrogance would purposeful arrogance however missive posted never stated anything intending arrogant inference,said implied said one favorite philosopher wrote mark educated mind ability entertain thought without necessarily accepting fact,indeed emotionally feel need enablement run die need accurate diagnosis run,wink mean truth specifically objective truth everything explainable explained hard evidence put
