ENTJ,poor men,photo wellsy,thing care today rotten baby carrot hidden among healthy delicious baby carrot bored work people sleeping awake opiate epidemic,cheshire tower find wound particular sensitive spot body wickerdeer definitely dehydrated put tuna water get drink force fed pedialyte,bang year old female cat month ago moved new house bang took sleeping shelf refrigerator seemed adjust well move looking back realize,,,tap,,,,,,,,,one hand called play good samaritan life roadside initial act one day must come see whole jericho road must transformed,,goldenhand garth nix,bought porsche stereotypic beauty fade still,,,dumb,,think spam day troll day would awesome opposite day,hiccup train dragon,take multivitamin heard people say fish oil biotin help also thyroid checked,song mother fucking lyrical wordsmith mother fucking genius little flat day asthma acting famous annually studio lost,job place,romantical,arzazar szubrasznikarazar like lot creep mouse stuff easier look different eh,hi silver hope enjoy time happy,e,,,,gryffindor por vida,,master social worker,e,,,,also pleasure listening short story zero meter diving team yesterday bomb magazine x x zero meter diving team jim shepard,listening mindsight,want make light experience thought cute know though p,,sai woooooooot,sound like lot work inspiration novel,heading australia month hang lover gonna awesome hoping doorsy thing even though going australian winter going
ENTJ,totally bug updated list gonna revive old thread adding one jason gideon intuitive vibe warm compassionate demeanor sensitive morally driven,response merrier,sonyx hey noticed big problem well since totally completely love committed see,prime example inferior fi use tip honing,,feel s,,lol successfully managed screw timeless leading everyone merry bandwagon shining butthole doubt want help ever event,love guy make grin ear ear,learned need careful say around lot time certain thing taken literally time ni heavy moment,hey hopeless answer question yes certainly someone special mind year wonderful man ever met amazing perceive,first want say much love getting response tedious question sub forum always content rich really insightful secondly,hopeless agreed entrpeneur wonderful extremely insightful answer thank much taking time reply,favorite movie tv show day,,constitutes criticism te user tend make objective observation impersonal statement pretty frequently think sometimes lead feeling,type thing statement action observation criticism question tend offend hurt asking would like know avoid,two year find hard time understanding need retreat inability understand sometimes leave feeling worried feel,like relationship seek long term relationship intimately familiar saying better worse would likely carry relationship,saw deliberately ignored rather question get lost swamp question,fi dom sensor introvert often require time alone process sort emotion well enjoy little world like understand concept best,fi dom intuitives introvert often require time alone process sort emotion well enjoy little world like understand concept,like relationship seek long term relationship intimately familiar saying better worse would likely carry relationship,like relationship seek long term relationship intimately familiar saying better worse would likely carry relationship,timeless started trend sorry blushed anesthesia please new one sit well,know mistyped least time considered possibility type know incapable,awesomesauce thank much,treebob timeless promethea cheating well anyway would like name changed vitruvia pretty please,thread short intouchables silver lining playbook sentiment flesh lie diary nymphomaniac beginning end girl interrupted heart,going right mindfuck even wrap heart around thanks advice though appreciate take matter might heed let,tongue,know tendency aggressive straight shooting controlling narcissistic whole slew terrible thing working also completely pacified like,must cause violent gory dream ever since kid one particular public square somebody hired hit gunman came,may like retract previous statement come realize something pretty important speak s known couple unfortunately including,,kso started one thread s awhile back noticed one stickied yet starting one guy mostly selfish reason bored,isla pretty much spoke mind shocked,quote information although extent eight fear physical harm far important fear disempowered controlled way eight,welcome need leave friendship comfort would recommend next time get moment spend one one find gentle,back,par octavian regarding issue seeing also w enneagram sx top variant stack often feel possessive protective so,elaborate dated past year tell many post made go end well despite fact shared,,xnfp discovering friend pretty inside,,know topic brought seems quite time ago wanting rehash old thread decided start new one without giving much,jjkul siggy oh gawd laughing mean go happily unnoticed space right fuck might say type likely win oscar,wish know,sometimes get sense much information take enough brain power devour recall frustrated idea much learn way,early twenty abruptly cut contact last night unusual much peaceful demeanor either definition
ENTJ,si stronger se ne stronger ni fi stronger fe even close ti dominant,rather given something useless like food gift hate get chocolate christmas,foresight simulation ni te blunt often disregarding others feel sometimes say thing others get offended,right handed printing shit matter much worked improve fact everything use one hand like like soldering electronics class thought,three s sound depressing well graduate soon enough,lot common nt,rather smile,jeff abed troy britta annie shirley pierce,main character say michael franklin trevor,bad attention detail lead lose mark math class never get high mark test others usually get big deal people huge,desire create might able make money one day make something cool favourite type art film music literature waste much time expression,school started debate team year interesting,one know seem hate,student high school want meet s know sure none close friend s however want find s would,s s probably reason could progress early stage history s s know,spontaneous plan fails sudden change come time make perfect plan,sjs isxjs especially least likely get nfs xnfp especially likely get,quiz retarded,extroverted type etc introverted people introverted type etc extroverted people te ni se fi applies ni te fi se,big deal chemical weapon anyways even trust asshole charge u pretty much want excuse take another country,grow get internet go get job,,could care le unless trying run political campaign something,hate sleep sleeping anything sleep useless next day,never took official one one took online got something like however whole test seemed like scam,type hate pretty much every know sensitive tend worry much useless thing nice similar worse,said wanted back spaced said kept trying fix let anyways statistician treasurer controller actuary software,extremely atheist,die seriously want remembered everyone want history textbook,pro choice american think u right guaranteed th amendment though many useless parent useless kid helping,overall,mom dad get along really well part mom overreacts lot try reason seems make even mad dad,plan going university sure want,ntj stj similar due tj mean extroverted thinking example dad similar general emotionless organized sense te often dismisses,blunt alone scare people away nice part acquaintance still blunt though people like make clear say thing like like,know much seem share leadership manipulation technique however bit genuine manipulation seems also le ball,hell get weekday,high school tend keep writing process simple yet make writing complex research paper marked content writing ability,rushed expressing regret accept responsibility make restitution genuinely repent request forgiveness,run put preference weight training however one day week running h also second run second walk end weight training day,eh doubt significantly stronger preference te ti se si fi fe also description fit te description,anyone else function test always stronger ne ni score te ne ni ti depends test se si fi fe,think genghis khan personality type,show respect need employer biased english teacher etc inside though respect people respect used strategically get want brown nose,guess closet friend would quite ugh,everyone taking working as good go try hard well teacher teach everything tested need spend hour reviewing,think xntj colder fe bit warming believe think s though,dad mom get along well dad well many common interest would also lose temper quickly really arrogant mom love dearly,think s want think generally waste time unless find necessary memorizing name unless talk directly never,going read page say tend annoy also keep mind complete opposite function order u first fe group
ENTJ,agree wiarumas msbossypants like getting gift find useful happen often mostly buy anything need may find gift card useful,quite amazing different thing end world starter would never imagine trying drug smoking something big australia,literally different meaning others explained well reality used interchangeably without clear difference real question opinion,play sing music perfectly written know song heart impromptu seriously struggle never really well drama musical drama,feel way look friend want builder pharmacist plumber etc comprehend want thing even doctor corporate world,yes believe someone huge ego detrimental believe ego large often seek input decision affect others yet healthy ego,hmm good point probably right mean wrong thinking invincible egotistic fairly different thing invincible,often find overly serious situation someone told awesome lawyer cause always serious around friend suddenly become hysterical,personally enjoy company s usually find romantically interested,rarely ever ever admit mistake mainly rarely ever make joking aside would agreed msbossypants ego thing thing sometimes,trying suggest sorry came across,boyfriend reply either text message cost c stingy think sending message like waste much,find thing high school must hundred hundred acquaintance within outside school forming lasting deep relationship specific people difficult,thanks defence p think many people believe desperate housewife one bad woman gay guy show actually quite intricate entertaining,noticed creator thread male think avatar put haha,carlos yes guy occasionally watch desperate housewife,read anyone else response little rushed time year old male set high standard term woman like standard everything else personality,possible none really prefer either although guess occasionally enjoy seeing others crumble magnificence prowess would make sadist,like others much topic enjoy topic enjoy anything involves learning cognitive stimulation absolutely hate topic,grau great want rule publicly everyone see say hey leader world also love rallying people common cause convincing people,quote great analogy pisceanreve,thanks reply redline time apply think cv pretty amazing yo already federal member parliament city councillor school,hi executive turtle dear sigmund still welcome help boo doughnut,charlotte younger maybe around year old think showed similar characteristic imaginary friend personify thing would often run,experience starting new job see would happen s usually get nervous thing situation others said unknown,really know forward planning independent nothing parent say influence tertiary decision heard people going uni,year old member mensa think great organisation never attended meeting find many teenager event somewhat enjoy intellectually stimulating,fillintheblank yeah like people something everyone supposed unfortunately everyone high school,htc titan running window phone iphones following crowd android slow inefficient ntj window phone seems like perfect medium also,year old facebook friend often get random add people encountered occasionally accept particular discretion never send,although still high school always perception university somewhere go learn amazing new thing meet curious intellectual people high school,,guess seeking opinion seeing stumbled upon anyway found first video slightly humorous fourth one tongue perfectly,following awesome analogy s fantasise ruling world tongue find quite interesting s know answer question straight,agree outlook life happy content although feel thing need seek success money though unfortunately society need degree,would different everyone success rubbish man might finally able collect rubbish upper class neighbourhood rather derelict slum success,still secondary school long way committing long term career interesting lot lately guy think career united nation,like analogy haha know inevitably rule world wink,still teenager sometimes feel ostracised around lot people intellectual interesting get wrong though occasionally people go,although always test sometimes feel like bit think people think dual typed split e,dictatorship beneficial society thrive grow without constraint politics bureaucracy,said friend probably like hell talking walk away think looking intellectual conversation might need hang,feel awkward say even family find easier say passively example saying goodbye someone one phone person etc nt father find,emotionally connecting mean romantic sense friend family acquaintance similar issue people closer term friend think,haha right one big ruin formatting line break page plus automatically appear use text coding ie p,listener agree point first hand experience friend family see system destroys life people menial boring thing rest,typically villain either s s fictional villain s spend day behind closed door planning attack whereas real life villain evil people,somewhat agree logical sense smiley ingenious way characterising mood post help remove limitation online communication include lack voice,well page post unfortunately time read first heard zeitgeist movement really opened eye world live,relationship right would say never work well f want start answering question
ENTJ,,,hour written word around theory confirmed one point thanks,yes exactly experienced everyone experience way another metaphorical force today written theory nde always result,yes people blame drug beautiful brain really power weak dragging u around thought feeling every single second every single day,believe nt sensitive others hyper sensitive external internal subconcsious input external data analyze intuition based internal input,thank sifan expect even though know alone hi must apologize wall text easy write short summary everything,guy also experienced similar attempting explain remember aware relate people,know stuff without fine something world stuff talking even though feel like individually like information thousand,apologize wall text suddenly give superpower anything open mind see put together making creative able perceive technology,also written jungian psychology well hundred book theory empirical study try google egodeath life egodeath,hi guy long time wanted post specific reason reason bent perception world thought knew even well average guy like,anyone addicted addicted anything like whatever make escape reality let focus nicotine alcohol weed similar,sure missed remembering avatar look similar remember though thanks back might overstatement felt like visiting maybe,year still see multiple thread participated must killed boring thread kept entertaining one alive,depends bond yes childhood friend seen year neighbour friend year took suicide feel like driving minute attend,curious something give reason remember information testing making useful test able work memory brain game workflow,remembers exact thread exact post,well yes quick forget name detail like band name song title actor similar remember band listen name people,way implying s impatient made pretty much best sitatation station got thanked cop referred two hundred thousand,made realize one really looked admired actively influenced random quote known people mostly remember quote,money object work hard get work harder get use wisely reach goal require money never let control life,ah interesting would go far prove point even enjoy told sick today sure even think might fault,lending nose spray friend harmful bacteria lent nose spray flatmate sunday told wash thourougly hygienic lauged,captswan meaning life meaning ourself choose give long true without doubt meaning life make meaning life,sound like either little much cake,worry fine wisdom still place teeth pulled reason freak got mail work related medical,wish internet open free everyone use every coming site entertainment news end year old whiner troller idiot name,learning experimenting human mind intuition whatever mind offer filmmaking thing four year thought,people tend look problem created last generation big problem forget take look root solve one problem another one pop,went look new thinner slim jacket coat current one earlier today ended new suit instead fair enough compromise although still need new jacket damn,agree much wiaramus problem one care fast type care able read understand word opinion interest u,far understood post soured lie said keyword shepard playing sheep feeding heck wolf many metaphorical term long,wrong saying parent one allowed home school private tutor coming house day week teach child much,well used tongue word get far someone tongue already warmed let go waste like warming marathon decide walk,believe expect much repeat stereotyped seemed like cool guy work hang win honest casual relaxing long efficient,may ask next time start thread give u situation something go yes question situational based person school parent people get,may seem come offending even trying offend similar post earlier thread originated first post fact trying explain,apologize ruining masterplan,like two month straight went inactive period every day time day last week decided quit bullshit get shit,simply admiring reconstruction titanic sank min short film scene last min spontanous little hobby project others built day always fun,understood much worry failed okay maybe little thing type start argument without something trigger u anything,get already happened uncountable time keep happening even moment writing four nt talking needle haystack compared population,start torture thing right away sounded great,young people easy using trick year except one find useless often used like call call button also scrolling big gallery,make thread title misleading seeing list never complete unless gathered total sum information gather whatever happened,list expected list einstein einstein hmprfh,thanks posting interesting helpful relate everyone comment lot,taste comparison cheesecake favourite least sister never heard low carb mean eat love know,often reading article never realized part browsing last day gotta love professional
ENTJ,vctn started working college group project together point exchanging email pertaining project could tell idea thought described,love reading going inside average head flirting remember first time tried actively flirting wearing blue,lucky enough meet guy year back happy together ever since clue two work well type determines compatibility,antahon short guy told qingdom seemingly bad mood get lost see interaction several year later though really mean,iamtp notice known several year family frequently accuses caring way show care rather subtle delayed,relationship one guy two thing note thinking caring others way often demonstrate outwardly care others potentially,yeah afford one frankly people wanted know tip regarding way get motivated even specific form exercise,good friend mine would like get healthier begin exercise regimen problem motivation however like seems need workout partner order,hmmm one know variation often sh come discerning mood another person unless mood made glaringly apparent s,relationship care much nearly year well exception one pattern behavior get past b f,honestly think lost father term amicable relation hard grasp xntjs tend retarded come affecting,simply put need construct rational logical argument behavior indeed negatively affecting family one includes tangible evidence negative effect,thought would contribute happily dating cent want know attracted answer experience based read,cosmicjalapeno currently dating microwave skillz indeed impressive granted microwave setting said microwave plugged,say least finish high school unless plan self employed potential employer care learned level generally want see least,dukempriz instead using typology draw line family try use tool better understand communicate fact matter,maybe try see like people attempt contact often want anything hear see pleasant surprise besides,understand appreciate desire intrusive trust say likelihood way slim none guy infrequent typically,four word lack direct communication like something say way demonstrate outwardly diplomatically say well thread provided,find s mean someone else already noted usually reverse accusation mean made dating several month thing,hey hey beneath cold exterior lie insert something poetic implies depth feeling angst esoteric manner fair want share emotion,graficcha thanks thorough reply major emotional issue contend rare moment would like vent bit xntj expect,turn hoping simple inquiry read various thread forum s generally like emotionally dependent understand,noted another thread dating definitely physical touch demonstration feeling certain whether quality,well stereotypically title likely would go s often seen fair share womanizer cheater well though,chime dating one uncle father dating child dog treat manner,brief observation one best friend grandmother s experience tend get along much better s sjs general age group older,op know putting pedestal individual doubt s tend think thing thoroughly acting stating,believe pairing among least likely occur someone else noted would imagine relationship much rare see average,give people care value time care someone initiate contact person consistent basis really really like someone,others handled specific question well add one point think x pairing one work much better male female female,would like second surgeon suggestion might also suggest really thinking long hard entering medical specialty dentistry dermatology would almost require,w make sense definitely usually test low,believe never think view arguing general enter argument someone try hopefully solve problem,disclaimer know g f type long lasting relationship close friend said one arching lesson,warning book ahead begin asking non type related question sure idealizing relationship longer aka placing much value,romantically compatible experience absolutely hilarious creative highly intelligent make great team working project like capable,meh mom functioning alcoholic dad borderline personality disorder currently high dos anti anxiety med instead therapy nt,ah ok admit form consolation word comfort thing feel rather useless pointless seems work quite people though often try offer solution,note said detached physical sense none listening mentioned involves touching know person well comfort person physically,others said know distressed person somewhat detached least term physical contact one thing bit success simply,known s well one unhealthy given plethora story already available situation detail healthy one great small dos good,think answer inquiry relative individual say ex indecisive would get briefly,sigh remember phase interpersonal development mid teen realized overly harsh people particularly came rejecting way,two friend value ability eloquently often elaborately express fi also ne driven creativity said s also often hilarious,borderline e still introverted though usually test enneagram take following grain salt prefer plan made ahead,echoing real sentiment say corny yes s value sincerity furthermore often sense person fake way mile also,close lately short said stated numerous complex feel inadequate many way currently feel though,ok include detail first time yes grandma reason show sign listening even said would take advice,gut agree done biggest issue one nothing going seek female family member gossip
