ESFP,know say know right,probably right though told wanted family next couple year girl met found reason leave,yup wanted fix told beginning either overestimated ability underestimated severity condition know need work knew,basically fulfill said smart let emotion get whenever debate constantly felt like attacking something,gotta listen guy requirement girl fit hence chubby like super skinny smart standard materialistic asian pretty face,misha thank giving cent feel like need clarify smart enough fat comment several occasion said thought smart emotion,marimeli maybe take lot thread ex perhaps give advice know link though,love men read cannot deal someone never put hand book first thing went man place check bookshelf satisfies curiosity book,classy mean high class bourgeois ppl mean ppl appreciate art language old wooden furniture make sense,think hot love flip book ask smell mahogany intensifies mood nerdy yet exotic thought love book,omg glad found people feel ex love complaining everything anything street sign server restaurant,seretonin level heavily regulated ssri,guy like fried rice land keep post coming please response wake much appreciated,oops normal love someone want person happy stable think way make happy leave,mind getting sarcastic response new good response,argh new know guy quote part post thank thorough explanation big heart agree certain extend,challenge damaged girl needed rescuing realized deal got frustrated make pretty clear insanely crazy,broke said stressed stressed tried really hard positive cheerful met couple eventually together,call hopeless miss much,appreciate honesty opinion first live culture men tell woman mostly grandparent generation might subtle tendency,quote gingertonic gingertonic problem wahhhhhh reason boyfriend dick well possible solution situation get stop,wahhahahaa jackie chan btw,lot people misunderstand term validating feeling like showing person acknowledge feeling okay feeling kind,hurrican typhoon yes get mean precisely think could handle much experience since born,good one thing targeted right people got bpd like validated feeling showing understands going emotion,know first time broke precisely said stressed stressed first break dealt stress problem lot blubbly,dealing emotion one big problem another major one said cannot engage intellectual conversation certain topic cuz get defensive sad said,shout people took time read post esp replied thank stubborn fxxk guy great job convincing making feel,agree anyone take shit aka tough one said could handle originally cuz ptds mom bi polar ex looked distress woman expert,practicing lately mindfulness let thing come go without minimizing exaggerating became impossible couple day sleep,okay got super dumb thing ask basically know answer already needa hear someone else move pretend move make stop think,live family like unmarried woman tiny asia city contact rule get driving nut texting emailing,came back anymore,wanted one pursued saying respect choice leaving leave alone,need think people working significant improvement last couple month understand personality disorder cannot dealt,yea leave anyways respect monogamy practice monogamy believe men men gene make sure spread,love cooking cooked love spicy food love animal talk animal hang dog lot got yoga certified yoga,last friday next session friday thing got much worse since saturday met looked text conversation analyze u tell,accomodating thing feeling based step s easily let stop stubborn shown sign giving tried,hey nice trial period depressed last year one made actively participate therapy actually gotten better,think appreciate way let stop convincing compatible,probably unrealistic think eventually know dream girl exist closest usually took date decide want,way way verdict give,lot thing mention like going couple therapy getting way make happy,need clarification saying enjoy initiated thing enjoyed much get kinky crazy time love,constantly wanted tried satisfy much could tried different thing bed loved know point interested,single long time met guess little part want relationship guess mind much,actually second time breaking take back first time boredom think,date day thing sure trying prove something mention girl city tend love money seem think white guy city,good question think potential person make happiest person earth said potential said wanna wait anymore
ESFP,highclasssavage,crush kill destroy,urien,poloniumcyanide still talking enneagram information provided useful talking mbti strongly wager xnfj quite,preemptive rejection society denial vulnerability exemplary example vulnerable showing soft side one,zato,would agree typing based relating fictional character recommended said morrigan definitely self preservation hard nosed,car able go wherever hell please whenever want feel like castration,,lot told like marijuana turn brain cocaine always seemed like would particularly appealing heightened feeling,triple reactive,nobunaga,kintsugi fair enough interested pm,ah glad asked little seen thread sub forum demonstrated skepticism cynicism contradictory assertion misanthropy possible,putting word mouth lol asked question responded wink kitteh,dumbest shit ever heard opinion invalid subjective reason believe opinion believing someone opinion would,even argument opinion inherently subjective otherwise fucking opinion lol seriously claiming opinion invalid,bruges fuckin hilarious,number low forum exist lol mean respect find people use phrase often used,everything happens reason empty saying hold far le weight corpse likely said people say rationalizing cheapening,primary color red secondary color orange,pelopra agree majority observation type think bit come option prepare worst case scenario even calm unstressed,hk,variant sexual laughing,sx sp fuckin hate people nuff said,would like input type currently typed w w w sx sp type considering w w w also trouble determining sx sp sp sx social last,like response actually respect lot power doc,ay doc got little somethin ya new shit market call val id ation rx guaranteed get need met tired feeling alone,recall correlation ni orientation towards anticipating planning future,disagree jaime feel live hype hype universally despised mass seen arrogant dishonorable immoral kingslayer,mom w w w sx dad w w w w sp sx,nah holy idea well thing spiritual enneagram sound like bunch dog shit,friend sister put lightly cat head course want cat get hurt,totally topic anyone ever put tape cat eye completely obscure vision one thing cat far fucking retarded dog lmao see dog,cat swear friend cat poisoned hit car lost several week came back fucked get fight neighborhood cat frequently,ahahahahahahahaha yes exactly trope,noble demon,incorrect thinking jcf mbti deal categorizing according logical principle feeling deal categorizing according value sensing deal perceiving concrete,nah wanted asshole shrug,reasoning yet hear,consider best thing enneagram reasonable framework better understand people,back flip fucking joy discovering type seriously doubt typed correctly,eye tv cause tragedy thrill whatever flavor happens like killed husband drowned ocean shot son,laughing yeah noticed lol actually as man cool must rican lol sucker big boob anything lmao must say,lol initially going say let try get back fucking topic since thread good saw cosmic orgasm already shit course lmao fuck indulge,lol evil evil woman libido high enough last thing need photo curvy woman get itch going laughing lmao tricking woman thinking male,way put perhaps bit exaggerated well everything else said thing actually good thing make cringe though mean,say deep wound least something worth mentioning though far darkness go say one thing always aware sadistic inclination,know describe intuitive thing maybe shallow see photo beautiful woman bearing curve make fucking horny lmao oh,kind woman blushed lmfao
ESFP,partlycloudy men lot like fish like shiny thing wear jewelry invest hot lingerie pay check put software memo line perform strip,able say mary poppins big word forward backwards way syllable syllable letter letter know entire morse code knack taking new toy,verecreperum scroll way top see waving smiley emoticon far right test tube icon click bring menu test,get mind nurse baker,think track many comment collage three song sung time kind visual action may somehow instill message mind,enjoyed movie preferred opera format tolerate watching scene three people singing different song time bit much,gonna tell u digger blue,site large window includes view window labeled hybrid window bottom currently typing bottom screen bar slide back,say simon rather f would however make rational rather guardian mulling ruthie think went around talking holy men town one,considered one best family fun show fun watch whole family age appropriate family thought incredible introduced guest,digger blue course,manwithouthats much nice job digger blue,meet mountain opportunity jugginess presumed dreamed slow learner likely prep x x x cool period going backwards x,antrist point use word dolalli digger blue p nice bike,manwithouthats careful going wind one people believe lunar landing real mib fiction digger blue,friend experienced ultimate introvertian utopia digger blue,feel badly syrian child massacre thought writing politician would want achieve military response reading cost war,wasp criticized participating thread see someone pain need compassion another person consider,previous life known colonel tom parker db p spread around spend one place,make payment via paypal see get db,marketing question judged worth selling marketing guy digger blue,selling stuff digger blue,hmmm seems s quite humorous exactly league course everything tut tut anyway book read found insightful,richard positive attitude licked start positive thinking lad regard digger blue,rise occasion stay close contact mentor german farmer used say time pray time shovel shit pray shovel worth,typed password username box whenever try enter username password show programming detect something user name box never used,oh think texture incredible course enjoy feel chump may touch effect screen work well perc app,blog looking forward right number tag available could live could live cannot stand offered limited digger blue,want virtual arm head rest digger blue,think dog knew giving aide knew could welfare would much rather find pet neatly set side road,qingdom unfortunate experience riding back seat car college freshman volume cranked way sitting back sort mainstream,oh might add topic woman much lower score right right time tolerance digger blue,wee bit confused statement often right witnessed situation cannot know exactly mean situation would say right,world war ace ace german manfred albrecht freiherr von richthofen alias red baron suspect one machine achieve many kill digger blue,bowieownsmysoul greeting everybody looking number one hard get people work building community thanks reading comment quote regard digger blue,bowieownsmysoul different view child killed school another student gained access unlocked gun likewise assault weapon may,read enjoy page see people putting movie clip avatar music kind thing accomplished way icon window,trigun spilled root beer db,painful prickly feeling experience trying withdraw handful sheetrock screw carpenter leather pocket considerably sharper nail digger blue,naw trigun even make spill root beer digger blue,contemplating eating something primal delicious wanted beer also wanted peanut butter jelly sandwich used special peanut butter devoid trans fat becomes,worked rationalize thing come answer look fact seek truth really sure come right,much long shot winning lottery matter want achieve something work say everybody purchase one thing digger blue,happy read list tag found practice however get two comma minion change direction indicate two,fourtines take word santa ana wind however tell alberta clipper digger blue p nice list add freaky sound ice,ever notice military copters make noise commercial copters figure one,brings southern comfort mind digger blue,seeg love must say however love best motorcycle base tone rather say high pitched whine crotch rocket hope one day play cricket hard come,ziggurat little secret gen interested woman got profile runty nerd implies somewhat small probably linebacker,heavy blanket oh yeah add one rooting underdog seriously kick as digger blue
ESFP,long story short met girl last week thought pretty cute bubbly personality youth group went bowling friend planned kick back,thanks giving input see confused try clear least amount word possible recently met girl talked genuinely interested,brilliantly retarded clearly read last line post read whole thing talk,wow one,girl known four year feel moment something kissed time however within four,bump anymore thought,right think laughing matter taking seriously feel like thought highly kind deserved shot mean way,known guy year say one best friend recently conflict dry told girl,jesus s horrible giving advice made take test even read make sure exhibit trait well depends classify typical,bump need opinion,expect answer hard understand post tl dr thing problem trust issue dad trying get thing,hello everyone dad lot thing want talk today get better insight thing worked understood u,know lot girl well tested s laughing anyways one uniquely different know question seem find,sbel thanks advice information also providing situation life think might give whole message thing try planning waiting til head room,suggestion approach like say message want come deep cheesy,well find awkward lol wait til college text way come back weekend something talk soon get home,see since already tried talk would better gradually talked day think long awkwardness fixed relationship,one friend suggested feel awkward going react sent electronic message going avoid making eye contact etc etc like endless,okay situation right make quite sad depressed whenever think hard dad pretty sure made take test guessing mom,see explains lot using weed would possible function used thus grown quicker differently make sense lol high get,wow thanks elvis pretty convincing word guess accept lol also another curious question weed alter personality notice,thanks reply wanted address thing though though mj criticism imo fine stating improved let touched felt,would prefer told first hand experience explanation possible esxp fluctuating f based hannin,think feel also taken test total three time first two time recently decided take test,well sort got text fight always mess head replying one word unclear message told lost friend,else say guy right knew one liked asked opinion know feel end choosing one would unfair,bolded sorry lack clarity,thanks reply really helped totally agree feel like guy completely seeing point view post replied referring,uhhh sorry wasting time making post would like inform misread information clear enough known year span,,intention eventually settle older least past thirty want able see option girl friend necessarily mean,sure,see help thanks anyways way attracting girl problem deciding one,look long term commitment make dread say stay one girl rest life think go crazy,taken consideration well maybe ready wise wait,ahhh forgot mention ask spend time problem go different school meeting convenient keep mind,glanced sex relationship section seems get better answer posted specific personality section get different commentary,hey everyone want share brief background knowledge relationship two girl order help understanding going post personality category,hey everyone want share brief background knowledge relationship two girl order help understanding going post personality category,hey everyone want share brief background knowledge relationship two girl order help understanding going post personality category,hmm seems like need meet outgoing fun general great people depending fill weakness bring,well introverted alright alone get energetic hyper around lot friend good conversation home,depends mad get people feel humiliated as going,know thread kind old situation going,really maybe mature enough met right,think guy met thought top complicated,realized something s never give used like girl got know personality jeez never admits wrong elvis pretty much nailed,know one opened one option hardest time deciding know one choose feel choose one might miss,dude gtfo plz lol jk say said joke lot,go something looking forward hearing right part think working as way make future easier
ESFP,good job william,yes self interest selflessness seen human animal behavior would lead one believe inherent philosophically bit convoluted mainly,,good feeling transitional phase something grow,either calling ruds uds went ruds p besides point point experiencing something temporary problem disappear,well think reverse ugly duckling syndrome dealing people become easier grow older oh gawd welcome hahahah,well good honestly think worry people probably say stuff like think get away kind true since,sound like problem p lot people put double standard suck life maybe learn ignore people like obviously,hahah awww good debate someone street corner decrying world going end soon ended ignoring argument continue,holy carp shocked hahahahahah laughing go tongue,joking maybe get smile p experience people say kind stuff trying brighten day maybe get consider going church,oughta teach jesus trying love nice instinctual response btw first instinct response niceness also flip xd kidding response,really computer enthusiast per se even much prefer amd strangely reading make happy,well guess world never know,thinking joining church religion always centerpiece life wish man god people would much better god ruled life,sorry inconvenience really need talk feeling,welcome perc kind underwear,curious reason mean want pry curiosity getting better reason stupid irrational used p,well meant like someone met something annoys try judge dismiss quickly like keep open mind person,going go subconscious interest desire,could person act maybe intent find people joking around playing prank one seem perfectly innocent playful others,well pretty clear think feel person odds one another maybe struck puppy love around let overlook,well answer well guess depends tease poke fun others someone usually poke person vulnerability,sure going definition egotistical person someone belief better others talent ability outward projection,topographical map lab mbti approximation archetype technician test probably longer,ego messing around long obnoxious healthy self esteem huge ego feel threatened bordering narcissism left,selling vacuum cleaner door door sound like selling bunch lonely old people like chatting old people probably talked young person year,logical tan yellow color logical tan sound like made color second time around yellow orange,offense really try following advice p op really understand premise post almost seems like gossiping,test okay actually scored extp gave tie breaker since really ne user outside work e n f j p,say winner saying previous generation console waste money think three failed significant way prevent saying,thought previous generation console loser different reason waste money except get rrod big,hm,combination top head w w although w uncommon imo,ack meant write well least jail anything lately writing thing mean yeah seem ironic really negative way,powershell barred canada another year ouch well least jail anything visiting family could come visit instead,like treebob asking canada let people u enter non criminal traffic fine could understand denying people felony misdemeanor traffic offense,many state allow non felony traffic violation considered looking person record reason many county traffic law designed increase revenue,true measure man treat someone absolutely good samuel johnson like true sure nice guy win x nice guy lot,would depend heavily employer value typically someone fresh college lack experience set preconceived notion true,making assumption term time spent compared much time degree worth efficient acquire degree start minimum level versus forging degree,technical job require degree degree certainly help instance ge frequently hire technician may may degree people,pernoctator think recent trend indicate user arguing still correct still minority come degree holder v non degree holder,accept idea sexy cute change vote sexy cuteness ftw proud,welcome perc enjoy stay hopefully learn lot others probably least likely fun least also like username,definitely prefer cute woman sexy preference long remember cute happy personality retaining sense innocence basically,fantasy would think ne type would rather bungling committing crime,using bullet made ice fired pistol compressed air rifle would never advocate murder stylish way operate,read op shake head continues way guess people actually fantasize,welcome click
ESFP,paranoid logical beard,really bothered think reason,yea yea get ya depending lot thing let say example age might decide honest testing grown know better,think lot thing change people time success age experience environment change people hope best,best happy optimistic hopeful determined easily excited positive successful mindset open minded enthusiastic worst addiction egotistical superficial self ego,tanstaafl ok growing responsibility change people,agree interested come learn,get slightly ticked introvert page well really extroverted haha,make sense consider worst mtbi type u bno type different equal like human being bad experience people type free,lot people starting think better type say oh look awesome type really later find type better another,sound like,everyone live antartica ah wait penguin,suppose would apply straight people since interested sex friend opposite totally sex friend anything,good point guy perhaps circumstance life changing quick mind readjust someone may temporarily change type switch back true type,think mbti change age discussion time,intelligence iq intelligence emotional intelligence moral intelligence body intelligence effectively everyone genius haha,would think easy tell apart actually really similar classified sensor intuitive someone developed hidden side example,see adventure possibility wheat field open new opportunity could also someone running away heritage finding freedom corn field whatever,bump,know sensor worst present anyone could ever give theory book,haha fun title pull really saying would bernie taupin type elton seems either never much said brown dirt cowboy,bit strange two side speak firstly spontaneous loving suppose inspiring easily become excited passionate love love,extraordinary,ever shut crazy idea awesome derived word dude would seem,hola espanol e muchado bueno actually make sense haha bienvenido fellow gryffindor let u ride broomstick play quidditch,thanks,win,posted see level random thread risen thanks lion,huge risk taker love thrill ne dominant way,candle haha candle wind reference anyone,lgbt find hard understand reasoning fact getting energy people v getting energy really big quality look girl yea yea,thanks,mean gee robot,posted watch mortal,haha seven drawing relate,bump,unlikely possible likely get easily distracted fact multiple time,personal name preferred called awesome person haha auburn fine nickname username auburn auby auburn aubs aubby auburn awesome,thread ask likely type function would something example likely would lost word etc begin likely would,okay eagle specify breed matter mostly solitary use intuition flight also sens think develop strategy often always,type bring,e bad haha even know word bad donde e en mi elephante,haha ramble long awesome pero visto mi sombrero si yo visto,ah see well housefly may squished unfortunate flyswatter tragedy valiant though would ah journey begun,hullo ah famous haha highly doubt old timer thank none le young hobbit brought site searching something personality,scuai woman men life party bothered disorder afraid wrong thing often late level emotion afraid draw attention self worry free,recently seen thread showed picture animal typed need know analysis type rock hyrax would general since two hyrax animal etc,exactly,useful information mwahaha thank kind welcome guy,well think give shot e v first know extrovert may typical extrovert type party loving full energy excitable
