ESFP,marathoning anime mmo sword art online game life,cool story bro canada recent year folk india barely old enough remember anything damn shocked much traveling people done idea,also dealt lifelong anxiety find easier said done sticking healthier lifestyle help minimize symptom kind person need hour sleep,nutella bland,learned apparently dangerous take kava root longer month due adverse possible effect one liver,bit worried come unoriginal like piggybacking thread thank posting pretty much sum major reason even engage,ugh hate tonsil stone painful quite annoying think sell numbing gel store kind stuff help pain day,sound lot like going right recent job coming office assistant inspector one town new inspector different town pretty,marathon grey anatomy scrub e r give nurse really hard time,still found either high school naive egocentric thought going revolutionary cartoonist something tried art psychology computer,pretty much nailed one problem thanks post helpful even reality dose,yeah working really help always noticed better mood next day kind right never saw involved field job work construction,ever since started work routine felt barely anymore time despite extroverted inclination paid attention time first,look someone overdo quality good listener quiet sit ask question make feel like,well thing colleague racism might directly mention race probably find thing two annoy moreso would anyone else,,dear self put yo sugah mah breakfast anytime babay sounded horrible dk bad,month actually sound like pretty good deal took wing chun cheapest found month month attendance rate twice week,tried working sears lasted little month first two week appliance sale associate one willing really train phone anything else commission,strange interesting far welcome polar opposite,funny say started really appreciate music last year actually theory older folk appreciate music people age,well want know,heavily considered falling back studying accounting getting possible master seeing kind regular stable income job could find field supposedly,like postsecret le anonymous,want bowl sugah gots plenty,regarding last part mean way around john saying thing piss david post post given know entire situation david,speaking experience college history trouble like anxiety depression issue start get head people come high school passion want,make think bruce lee response interviewer asked considered chinese american consider human,guess talent skill earned year practice dedication human said easier said done course never late pick something,kinda sorta relate indian really partake culture anymore religious speak hindi punjabi detest bollywood film cousin learned,group good friend always intimate connection given point everyone taking turn conversation sometimes looking opportunity,yes point post yeah okay,friend facebook status real life everyone else usual response quote bohemian rhapsody response quote david dentist,researching grad school making appointment see alumnus service old college vaping away,mostly pullover traffic infraction always polite polite time cooperative put ease engine pull key,fortunate enough office setting right took plenty retail job lucky enough chance think thing really miss retail,first job unless blessed enough luck kind office work usually sort un fulfilling mine dunkin donut free coffee back help,aw hell fan seven,kind thing nightmare sometimes people want actualize life,say travel world get bitch get car bullshit reality never cook meal ever,suck area ton within mile radius depends commute drive social life succeedsocially com good tip social skill method,man dropped bomb thread,think people looking increase muscle gain workout holding fapping increase naturally produced testosterone bloodstream,bump day old thread pretty much people advise college best used know going high school went community,deny existence white privilege see driving oneself assume white people evil oppressive help matter ethnicity,company year sound like certain habit led become bit comfortable co worker kind behavior acceptable playing,wine plenty,used ipod touch record verbal abuse person sometimes phone past actually helpful lucky state one party consent think,anybody else ask reference co worker side manager bos sound horrible talk little work asking stay two,someone used work clerk social service office handling application people looking assistance understand feeling see people wonder
ESFP,edit forgot board,currently reading artemis fowl eternity code eoin colfer shepherd crown terry pratchett snow blind christopher golden,hi got spare time else would spam world vote please talent little finger frenemy face creative genius simon,babymetal best band decade,banned fire hazard,win would nice,really get thing tho keep eye ear number called plus put annoyingness ear ache,lately reading lot graphic novel need book fast paced slow start lull action end something else like reading,rough certainly look prison stats think find higher percentage sps relative percentage,agree,think school system affect sps negative way yes,freedom answer many question,prone self destruction way hurt people around word self destruct saying thing push people away long term friend people,note let know updated result table point,grew last inch,know worrying thing,attention span moth amongst firefly,think really mean acceptable v unacceptable even weird v normal term personality disorder almost certainly thought stj,thanks letting know broken link try personality disorder test,anyone say anything know similar mind test serious make everyone seem crazy fact people real personality disorder,thread personality type personality disorder take test paranoid score internet average schizoid,,symptom histrionic personality disorder uncomfortable unless center attention dress provocatively exhibit inappropriately seductive flirtatious behavior,negative trait may seen others unnecessarily coarse behaviour life choice may unable value may ignore preference need others may perceive,really weird firstly mod would crack real hate secondly u s drama word make mountain mole hill,thanks reply past future really quite fascinating,real difference negative trait personality type histrionic personality disorder,sit face tell love monty python,banned spouting nonsense,usually original version song best sometimes sometimes cover better original place post amazing cover beat original,contrast people humourless tumblr escapee social justice warrior,,,yeah usually creepy one sometimes someone surprise,knew would,banned inhaling said,banned english getting regarding geographical location,banned caring life stalker,everyone else bonkers kate winslet juliet hulme heavenly creature love movie sooo much,correlation mbti type religious belief would think assumption would nt likely atheist sjs likely,agrees going take whole country must see super villain,thread,fat bozo improving relationship good answer think girlfriend understand better know mostly,ever used mbti practical purpose,know laugh fun pretend serious silly lie silly lie ever heard scotland gun bad kay witch,ai tran spiffy human fat bozo perc answer homer simpson pancaketreehouse flirt gentleman probably pretty avatar,,sure happened mycroft picture st nd,best sherlock st place nd place,banned reminding awesomeness
ESFP,,office job almost ten year never stop moving certainly still get restless want somewhere else usually put headphone listen,mean meeting someone online meeting person sort online date,fo realz doe word,keirsey temperament website overview four temperament figure basic temperament becomes lot easier narrow specific type,thing,every day count internet,hate season worst weather wise summer hot still good thing summer still hate love texas winter wish,,yes,nope necessarily starting new group even know gonna new,movie theater kickball field tennis court sport bar restaurant road car work couch take time wink,think outside know mean zen function,freedom ability choose next action open choice greater freedom,personality disorder terrible phrase personality cannot ordered disordered,yes negative trait sound lot respectful person,many many time last six year used break ton communication barrier people life understand better past relationship failed improve,thing make anyone unique person individuality deal reality yes,yes much use,well live,sound like probably aiming weekend would best time difference,interested done video yet happy,confuse try couple paragraph break next time wink got personality stuff always amazed people would tell hard know,dunno s like rank friend anything like feel like traveler road life one anybody else yes want,well minute post proud,well yeah exactly said earlier post wink,never stop moving even asleep,lot people consider manipulative send message think sometimes,personally think function good way figure type supplement help understand issue sure type way abstractly defined,think s definitely manipulative often unintentional sometimes underestimate ability get way emotional mood swing,recent chat baptist pastor,sorry forgot update chat atheist last year,extraverted sensing feeling perceiving extraverted sensing thinking perceiving think profile might best seen son said thought,eyesopen finally coordinated time brilliantly answer vague question special guest appearance son hand eo cat enjoy happy,interested available pm central time though,basically saying want trick discovering type making convoluted enough fake begs question finding,,yeah sound pretty nf nfs usually one spend time searching type usually nearly big deal sensing type,something else think would try make thing complicated unless messing people attention,texas u central time,well case video subtle asking pertinent question even notice cool,take mbti complete know free pm totally honest remembering preference habit think best way,man weird question able answer perceive blah dunno tongue think mistake try match,sure could find bit time happy,little christmas parody yax tongue,well thanks explanation even understand probably shock hugely disappointed decision especially since several interaction,find usually easier look temperament first official mbti useful know anything person tell strongest preference e n,type description really get lazy someone incredibly lazy go typical type profile supposed rock star instead sleep,yeah could sometime weekend happy,hey uhh anybody know pneumoceptor set video private ninja
ESFP,sure love list spreadsheet,dunno really count badass one time climbing mountain live real mountain km high really misty foggy day,hey everyone realisation inferior intuition show wondered anyone else share heard intuitive type talk get intuition raw,interesting test think result corresponds right especially part emotion rising event already passed preferring action discussion,getting calculator budgeting much fun wheee f cking kidding great,yeah think right come see suffers quite severe social anxiety really trying overcome actually pretty cool good learn work,nice analysis like agrees already think p really cool indepth analysis everybody thanks hard work think got,borrowed electric scooter kept breaking pain as never got game enough go long distance pretty fun super convenient,personality hacker sure think site yet seem quite good test gave result article mark although three sp,exercise art read book internet tv organise hike daytrip friend sometimes go shopping right mood,intrigued ok sorry turned bit rant ramble think explained need different kind let know seem trouble answering,revisiting thread actually situation directly relevant made remember yo relative living u atm sure think,narcissistic saw thanks,sanguine phlegmatic closest type nearly right think ericb right matured become able think would want,husband told yesterday thought warning label said speech filter broken happens tired maybe would warning speech filter,warning high energy unstable particle,yeah seems like sure said hate people use poster boy example like way give s bad name prime example type,true finished job back old position involves lot walking around etc still inside day even bit draining time,different description italic mean sort fit italic bold mean really fit s love people excitement telling story fun spontaneous impulsive nature,thanks myjazz really helpful apologise anything want go back reread questionnaire see spot recurring pattern mentioned yeah,thanks mizz indepth explanation much appreciated originally thought noticed actually husband pointed inferior outburst tend resemble,thanks much input particular reason general feel get,little help,thing finding type know enneagram mbti always jump around,taking stab think w would show pretty different even enneagram different mbti mbti like coldnobility said,described sound bang like enneagram tend correlate strongly lean suggest checking enneagram well,opinion using fe ti see fi one arguing keep name depends real reason wanting keep name really,really good questionnaire thanks heap herp aspect personality made unsure type think overanayse little bit x like look everything,think right guess take pretty high level self awareness speak term though like always thought introspective maybe,took career test result spot although short might really significant think correlation mbti also,cannot express happy made keeping quote photo intact see,even forum invasion thread linked seemed harmless enough people friendly guess whole forum get filled malicious trolling,haha really real quote although rule book question one game zombiecide boring sound first zombiecide rule book little scenario story,yeah get mental fog well circumstance end staring vacantly unless go walk,excitedly going sit couch read rulebook love,excitedly going sit couch read rulebook,haha thanks sifan,yep definitely feeling delicatefrench flu recently quite active since definitely need get back co getting anxiety hard,garden gnome sound amazing starting seriously think starting business realised office life especially middle manager thing,yeah bug said need say guy definitely fall trap mean repeat stuff important short,went small business workshop today run guy almost definite absolute pleasure clear highly engaging hilariously funny competent,like someone posted reckon typing gonna accurate personality disorder like people said seems like textbook narcissist really,sound like fi lower position high level cynicism hahahah evil genius guess almost definitely untrue b sign low self esteem,free personality test highly accurate,see personality one fun mbti getting type name cool description science p,op got example article read sound beyond scope personality theory term science knowledge least would love see,hard one guess write book generally create something remembered important start succeed business probably storytelling,know would love described,sound like great set lelila mind sharing job,hm pretty interesting think like use phone well p
ESFP,tbh rapper,poem database error dennis menace drowning guinness eye prize dream fantasize average boi michigan true musician fight party,fuck space komodo dragon niqqa,people instagram great way facilitate self expression however find instagram trend tend escalate point many instagram model dress,amazing book recently bought spy super excited read,welcome,,,,,dormer hate xd magic micah bye tongue,thread exist decided make one post music fit current mood start cool,getting see magic micah soon,welcome forum test using reality online mbti test provide accurate result need read cognitive function order determine type,,,many playlist one particularly good,bright clear w,,suck get better magic micah p,lol exact opposite math bane existence,,ap eco probably one difficult course took high school,must super intuitive impressed mind reading skill,omg going teach relationship thank sensei,wow interesting concept going pretend understand must evolving,,,sometimes compelled roll around ground make walrus noise told mean anyone confirm,,yes prefer need visual reassurance sometimes xd,,yeah got silverware really eatin though sweatpants childish gambino,yes ib p regret mean felt rewarding experience overall despite workload stress involved must say hl bio,brave new world highly recommend,,,,,,really worried posting photo want called hot hot thread labeled anything le probably,ayyyyyy pew pew pew,honestly accustomed making joke regular basis take drop walk egg shell talking significant going,,axwell stop porn,dis water iz spicy,,ok let give really well heartfelt thoughtful advice know might hard thing hear probably brace relationship,,
ESFP,thank response many thing happened past summer left say understand stand yeah really surprised lack,hey definitely want upset saying feel might input say find really hard communicate,personally think anyone le based anything human treated utmost respect dignity christian hold certain belief,talked friend like even dont know mindset relationship since moving hr away fall,ok previously invited along like trying see show friend weekend would free join theatre performance asked,first thank responding quick really appreciate feedback ok reread takeaway show displeasure previous relationship ended,u sophomore college fall friend year guy dated close friend year knowledge distance,woah woah woah like past relationship ended badly broke around new year dropped face earth came back month later,would keep eye long term goal seems point brought socionics far long term goal expressed either party best luck,s likely use special ritual culturally accepted formality forming relationship others mean emotional proximity relationship status,would think decision would impact would impact life short term group friend long stuff kept u entertained busy,please keep quiz forever perfect laughing,seriously enjoyed laughing got course p,hmm nice going management consulting quality management system consulting route got knock bba real quick though relate drive successful,scored masculine point feminine point androgynous neutral point,dad bio mom great right got married started go extremely religious wanted settle know eachother long bio mom wanted get,w dad w bio mom w stepmom clue enneagram older si isxj younger si enxp,know complete opposite completely resounded dealt many type always get feeling issue anything,hmm happens end perception least relationship whatever point time totally feel repeated conversation point hate,also also administrative work bba mgmt major average iq get bad rap since people think want party xd,held preconceived notion person already might possibly cause act consider way anything,want take away anything meaning previous post think worst people articulate feeling feeling articulated,apologize pointing little tidbit information definitely agree however burned people care much le friendship relationship,totally get loathe people cannot adult use word describe feel however good handful people mbti type notorious handling,texting back day later withdrawal invite go fun stuff moment notice possibly leaving plan open enough leave room convenient stuff come,friend told occasion mistyped ne circumstance talking im trying understand,think someone take account dealing age range ive seen mistype friend also,stop caring little cautious give care told life wish would care would believe,always perceived caring basic put people level people require le care people require need use caution,weakness would organization cleanliness forget mundane stuff time like laundry taking trash consider biggest weakness,care authenticity,daily db grocery getter focus r weekend car camaro s,lawful good pretty true either chaotic good,wear contact true forget remember individual anyone promiscuous,keep running topic must fate honestly really like people consider attribute really appreciate type well type,sun smiley sun smiley sun smiley sun smiley spot,like back say noticed alot previously mentioned trait know idea perfect everything internal set,hello friend heard talk myers briggs yesterday curious type took couple test got curious thought,care saying take time spell im bored interested becomes u every day leaning side every day usually,yes religious,building first impression summed kind talkative mostly light hearted topic nothing deep airy almost,girl like chance finding xd,understand better explain bear mind one two people good close friend stranger grey area half people,hate distant friendship hmm,quote mcnn answer thing adventure seem ne definitely fe extroverted quality emotional fi ne sure risk taking behavior,would guessed prof giveaway p love going adventure love meeting new people feeling time great planning spontaneous,hey ive seen around good bit forum would please enlighten best kind friend stay extremely busy im trying leave,sure one introduce mbti,curious thing turned,actually talked recently open honest explained family involved everything even busy friend work school
