type,post1,post2,post3,post4,post5,post6,post7,post8,post9,post10,post11,post12,post13,post14,post15,post16,post17,post18,post19,post20,post21,post22,post23,post24,post25,post26,post27,post28,post29,post30,post31,post32,post33,post34,post35,post36,post37,post38,post39,post40,post41,post42,post43,post44,post45,post46,post47,post48,post49,post50
ESFP,social description fit better probably description ever read typed awhile reassuring laughing,reason got bored enneagram awhile feel slowly regaining interest wanted point one blaring example fact,,usually go along wanted think reason go along others truly thing bother seem handle thing bother better,especially part overestimating psychological sturdiness pretty much view invincible laughing,lol preschool got tired everyone asking somehow came zookeeper told everybody really weird looking back never liked,nothing better signing finding post made two year ago finally getting recognition deserves,think mom get worst period ever,,lunareclipzee,honest idea comprehend know something integration disintegration line see manifest enneagram,called fourth way enneagram,lol spent month trying understand gave even remember made work octave note think like three mess p,outspoken image oriented attention seeking love hate relationship attention seems like hate relationship much,like oitnb south park might like desperate housewife mostly female dramedy like oitnb comedy usually dark satirical like south park although get lighter,crazy minute snare drum clockwork boa,excuse think know heather little bit better gonna slit wrist knife would spotless heather also must say impressed see made,really really wish could get screamo given shot know enjoy wanna say seems like try hard,congrats,w w w also known going tell bunch offensive joke run soon somebody get offended quickly think weak tends dead inside eats lot,excuse think know heather little bit better gonna slit wrist knife would spotless,knew would soon distracting theme time,,,,normal bitch take rest partway delivery omg laughing,want laugh bad,name snart,hope funnier posted,hawaii went swim dolphin one group got stuck trainwreck tried tickling stomach pulled rape whistle,,well heavy uh heavy durr burtation tonight dare dareson bite let go head terresh taysian discyuhbleh,personally believe,anyone really far even decided use even go want look like,lol wish remember inclined bunch color something perc remember said context gonna bug,idk talking,sorry omg sorry one funniest thing ever seen life look different flab go flying,,,name snart,waiting opportunity use gif almost entire year thank,lol know mean,need get friend first,smiley fairy,wow figured everyone donner party died,,time send gilmore girl quote unsuspecting civilian,,,poc
ESFP,esxp maybe display little bit f depending situation dealing quiz show moderate fairly accurate although expected lot,score personality type preference clarity category slight moderate clear clear clear extraversion moderate sensing moderate thinking,know typology overall lack accountability action general lackadaisical attitude toward life general really get bent shape laid,could tell thing taken make one type another take mbti test personality tell something different every time answer,either emotional enxp moral compass say esxj pretty close sent iphone using tapatalk,gotten one starting believe one buying second sent iphone using tapatalk,sent ipad using tapatalk,probably xstj anything else since think male super introverted monica biggest extrovert among two make ross introvert,look wise probably jason statham bruce willis sent ipad using tapatalk,ross gellar friend matter monica gellar,circumstance would provide reason lie reason lie make look bad lie discovered would s make good liar think,sure would cheat even partner cheating would dump heartbeat move trust big thing give someone benefit doubt,like people intelligent hold conversation infinitely curious afraid ask question humor big plus fairly sarcastic,matthew perry chandler friend look nothing like told attitude mannerism wise like sent iphone using tapatalk,think made accepting opposed thinking something wrong popular guy made accept people get,think chandler bing sent iphone plus using tapatalk,turned day ago noticing get older leaning toward introverted side introverted extrovert still talk people topic interesting,sent iphone using tapatalk,boil lately order really alternative could anything lumineers dave matthew band elvis costello queen stone age deftones alice,never really remember dream wind looking like drug trip scene easy rider sex random people one two,sent iphone plus using tapatalk,quote ummon katzulli xnfp jone close extp pretty much waver depending situation sent iphone plus using tapatalk,mine doc holliday tombstone val kilmer tony soprano soprano james gandolfini chandler bing friend matthew perry,greed pride lust order sent iphone plus using tapatalk,sent iphone plus using tapatalk,mid woman help approaching upper end group although month sent iphone plus using tapatalk,team sport getting away still watch olympics version mainly stick individual event watch hockey basketball either team good,worth killing people perception throughout high school almost quite literally process learn half people,s extrovert hate small talk know sent iphone plus using tapatalk,follow sport near like used getting sit whole game anymore becoming bored whereas tear away,think jon stewart colbert least colbert persona show say hillary clinton bill probably obama definite man,sent iphone plus using tapatalk,probably someone like jack nicholson closest think sent iphone plus using tapatalk,acquired taste like work blood track especially sent iphone plus using tapatalk,self explanatory question think certain type celebrity immediately come mind like think think adam savage bill maher probably someone like amanda,thought one time read description fit perfectly almost creepy socialize people albeit kind people,suppose depends said person considers fun idea fun could different others said would value intimacy anything else much sexually although,definitely sure become oblivious give crap anymore sent iphone plus using tapatalk,dr cox scrub sent iphone plus using tapatalk,normal situation like around people despite fact labeled way constantly labeled introverted extrovert,,hate boredom like productive also like security dollar bank provides said able job would,,studying test since distraction way reading internet sometimes intellectually stimulating sometimes looking cat meme,invisibility could much good bad sent ipad mini tapatalk hd,sent ipad using tapatalk hd,mac o,,band radiohead pink floyd blur grateful dead big head todd monster clash tool afghan whig,turn webcam
ESFP,funny mention respecting start thinking u v mentality fortunately view others close minded way bit pointless,lol look another one darn sensor thread remember never really felt welcome site thing never change laughing,se dominant scored seems plausible kitteh,considered sfj finding spirituality thing talking sharing traditional meal others seems si fe really relate,anymore,,wingdings,stop suck find someone interesting talk really want hear shitty day tbh laughing,yeah saran wrap analogy totally make much sense rolleyes patronizing attitude,,,lol saran wrap really terrible laughin whatever man,call b human complex matter type whether know always deeper level like saying peach,course work give dream shit people say forum laughing know really like unless experience firsthand,maybe typingneko,,quick,catallena please love heart,,,,ti si type,fault,lol guess open comfortable around friend dude anticlimactic bored hungry,,mean feeling like,personally met many s life dont much experience feel way friendship anyone general common interest like nujabes,someday laughing,well idk history guess maybe underlying feeling guilt something apthy,dead empty idk hell yeah would time,constantly look distraction avoid dealing stressing get upset end go back looking distraction vicious cycle,confidence nice face nice body attached face someone open minded interesting talk enjoy spending time encouragement turn offs would,hell break loose everything say taken wrong way probably hear stuff like supposed mean lot argument start,look dead eye ask see excitement face completely straightforward tell really feel social situation thing,try kitteh swap s s quote,,,gift would prefer item really want someone took time pick thought count straight money card buy,hate party part mellow,lb,impatient site bored,welcome kitteh,vote kitteh,famous music producer work coolest teacher ever cool,,think,lol schedule either excited gonna tomorrow fall asleep tossin turning bed whole night dreading tomorrow,get idea laughing name much easier spell,like something light fresh everyday special occasion use modern muse,laughing point like sweet
ESFP,interesting idea think right wrong think cuz right away gut say yes head say wait minute sure right hell,yes one pretty sure thought moving away together already learned order make truly good decision imagine,think wrong feel kind stuff thought thought realized set order moral idea moral rule applies,nichirenwarrior love cartoon,concluded myers briggs system support bias quality order descending prejudice sensor e extrovert f,contender personally like sound survivor need get survivory think like sound working,wild mad scientist comic book stuff make think bizarre description thing like pulling person bullet putting opposed,lotsa time want claim several reason ever seem anyone go around practically trying seem like someone really think,depends say trying buy car bought lot old one look new car barely even think new immediately imagine dinged needing oil change,without even thinking actually think stop look thing force focus stop seeing partially,found search engine looking something unrelated help laugh typoc v personality cafe talk much deep mature typoc compared,say seeing thing mean look person situation object see immediate quality instead see partially potential,matter look concluded sometime like claiming believe myers briggs truly accurate describing people disturbed claiming,good hate everything far tell thing make sense seriously thrown shit world without even asked want,diamondeyes yea heard book thing struck strangest part popularity mom read literary porn whole childhood woman,know think thing avoid riddle become obsessed become convinced solve even keep telling,much time spend sex relationship much would love claim maker disjointed bizarre thread perc unfortunately believe met challenge,point think s point lot people think s people think decide people type one,dunno enough perhaps look,tell write look whack as post,know actually expect anyone get upset thread thought everyone would get end discussing experience concerning,falling back typism instead addressing recent say epic post hmmmmmm know whatever fi ti clash fine,read,well since say guess must true funny people think whatever think must gospel someone else jokingly affect attitude said people get bit,nobody eats cooky type situation know explained well enough,thread observation concerning way seen people using myers briggs real life already said ultimate truth part implied title exaggerated,careful bearer ultimate truth strength experience neither,dunno pretty obvious pattern least half people met real life know mbti even think s say hey take test,joke cept ultimate truth part take easy observation,thread title great yes exactly saying,meet anyone real life know even little myers briggs probably think b matter type tell believe,well guess point strongly feel missing life somebody wholesome dependable concerned top goodness give sense wistful loneliness,expect brain development dictated genetics way hair color eye color sex intelligence funny people long ago accepted many thing,genetics changed slightest violent sex obsessed creature hell take stock conversation forum prove,whhaaaat found quite loveable,watched captain america decided believe movie incarnation definitely,slowly moving rap without noticing recently whatever reason suddenly realized really like want know everything,hate sloan make sound bad know good bad real come bad called sloan neurotic,euphoric vaporizer something intend invent,criminal cowboy sometimes psychotic sometimes heart gold wolverine tank girl dirty harry han solo athos offensive know sometimes,misunderstand post,also surprising surprising prevalent type forum surprising seems lot people want improve,say e care others seem think better introvert somewhat crazy idea people see around seem obviously introverted get,year thought finally concluded everything genetic personality sexuality intelligence body type everything nurture illusion person person,absurd comedy,four thing name fit first name popularity peaked united state wwii one big interest mention like project,notice using sarcasm irl seems others notice either always either extremely silly sarcasm mild stand,go like suggested song use trying fight public opinion identity whether wrong right first matter going,,midnightstar need vacation tunnel vision got thing serious seem feeling lie want people happy
ESFP,eminem could used poster boy go triple reactive w core fix started wondering dr dre,blaine izombie sure type though possibly extroverted gamma edit consulted,first think straight easy response human mating ritual rather organic laughing however like cat mouse thing like proactive,understand would hide intellectual appreciated s nice people hold interest value fe care,actually intellectual sense word earth like whatever discus practical application implication directly however,think science extremely awkward come sort thing rarely get relationship long dry spell course talk,yes used happen past seem aware people intention mostly naivety grew tomboy friend guy even making new friend,enneagram w maybe reason particular except anal since read mbti know,religious live one two three atheist country world face outside judgment whatever decide built,get better time somewhat social particular moment probably football season broke side thing,cersei focus society perceives woman power status focused perceived want power purpose anything specific,anyone seen movie typed character spot se doms sure rest bat seems like cp well batshit baby clearly,cersei possibly jaime could see euron one possibly daenerys think jon theon sansa,last movie watched wonder woman last series watched american god,load people bullied abused decided selfish act asshole one blame suicide except person,bit ot reference character necessarily sensor intuitive function primary therefore would tertiary ne,also place aesthetic environment else phenomenal dancer well indicator se focused present disregarded answering question,literally nothing show ne ti take,little le conversation little action self explanatory laughing se max,argue case take word,normal every breakup mean anything cause first bf cheated lost kg day able eat,helpful describe natural fallout breakup nothing make sense nothing interest see one else could possibly feel like one,anyone curious delve rather extensive article interview kurt russell never go style,gq pretty damn certain se dominant,hm revisit day far pretty sure idea enneagram listen interview,see ne shocked,goldie poster girl apparently though typed apparently top celebrity list time put past two s together,stop laughing,love last one gotta agree typing groot,new development quote imbb place seem almost si one se pin,since watched agree characterization clear exception danny joy danny absolutely sure sfp favor,meant nebula course thanks spotting edit original post thought mantis feeler sort,saw second movie start one positive yondu rest peter quill possibly fi user sure however xx,talking phoebe charmed phoebe friend obviously correct phoebe buffet though,exactly purpose page different tumblr page typing people also brad pitt chris evans seem likely,read everywhere luky,tmlt actually enjoy small talk,made laugh laughing cat tolerates learning guitar life music taste mind beastie boy anything else come even suffered,right sound like major red flag someone sort kinda like fall love,,try explain treading thin ice struggle formulating thought verbally high chance thing come wrong meaning something,imagine gamma parent would work well healthy physically mentally mean polr function si therefore,thank read post politely agree disagree,would say se preference direct real time observation exploration well leveraging immediately arising opportunity however trying put word,know p j indicate function extroverted basically tell whether ni te ne ti right p mean extroverted perceiving j mean extroverted judging thus,would say experience s distinctly different s therefore disagree,grandly different sensing function pair intuitive function se support ni vice versa therefore ni people probably able communicate well,developing pet peeve people looking n divide instead looking function se si alike one dissing ni ne nothing alike,sale might sensor thing yes sensor still however business becoming digital win involves prediction idea,lot wanted say wild already put word pretty nicely thanks kind word dare disagree excerpt growing best paid job
ESFP,ignoring animal think carrot especially pimped good pie nice eat bad personally love carrot feel teh,helloe going mbti type almost year month le completely stumped type would describe preference socializing,used rule world sea would rise gave word man cannon gustav,spring promise life life also darkness,sweden king sweden yas bow king sweden feel fiery meatball wrath go carl gustav,well falling stair perhaps got hurt sign look broken limb blood talking anymore might unconcious,even alive one could relate laughing,badass feel see laughing,knowledge gaining greater insight oh right phrased wisdom worried s looking s happen,yes p maybe great one,want find someone feel perfectly safe drown emotion private proud friendship want someone would take army hell,trying learn poetry go unexpectedly sand castle crumble dream,know s passive aggressive asshole lack social tact social power yet think reading people get anywhere due respect watch,hello think brought attention title statement smartest type dumbest type source popular opinion wink function function,cult talk get involved extensive information year study tell straight bat pure utter bullshit wipe mind,s incapable cooking food paying bill cleaning getting s generally try find best friend friend drop,acting happy music edit dauntless terrible painting,yes anxious,answer take responsibility tongue artform favourite,hahahah really go bed,whole song dauntless one timing laughing edit point always,beauty world would point living rolleyes,muppet proud nature beautiful screwloose set equal moral boundary great power come great responsibility laughing reply,im drug called perc forum,cool happy,really tough question think protecting love power able look mirror end day life decide live,whip hair back forth whip hair back forth whip hair back forth whip hair back forth whip hair back forth whip hair back forth,become low energy like extraverted sensing go fi te start working overtime get creative happy ideal girl like,however content enough internet conversation almost need constant socialization form bored quite sad actually important life,philosophical zombie meirsho plan ahead general life plan ofc know need done week plan minute detail supposed studying,want everyone like want everyone feel bring value life everybody like like everybody yes want consider,yep day stimulating eye upon practice mannerism fun center attention guy sometimes feel like nightmare want slip,love,fake nt need get popped shove em block perc one intellectual top reading book non stop life lesson filter information,sinking life get new day change situation floating get chance enjoy life happy,well large people studier people study maybe notice studying detect anomaly like quite easily walking around like person,great party finding someone connect deeper level also waking morning edit forgot beautiful surroundings make angrier anything else,yeah familiarity something experienced like feeling see guy see usually try show people get feeling catch,yes fun like little kid concentration problem come se doubled te think like situation like thinking,yes start whole lot new project time actually random one make past infancy stage edit actually scratch task,hmm video gaming friend chatting online going outside people socialize going outside alone look people nature music acting act time reading mainly,would hurt fly,yes exactly wanted hear,hehe cow man half cow take half,would rather say egoless people easily controlled ego control defense mechanism self identity lead setting personal boundary ego diminishing actually cult,heart s relationship keep grounded someone get enough exploring bring little excitment kitteh sure hope find,fear s however know prone anti social act try befriend stay arm distance evaluate kind start,hello hello,get impression s sort trapped cloud emotion thought dream accurate would say,ah seriously making story head song seems like wrote post link low post count kokiri forest youtube
ESFP,,curious see reason people chose university go went,like many people said definitely ntp real life always thought smart kid high school always sas mouthed teacher shirt,question self described loner way choice exclusion others high school always pitied people appear many friend,agree sure may couple group centered around common activity interest honestly think high school social group easy pigeonhole,hard define probably lot people say popular per se pretty social lot friend different group risk sounding,maximl okay realize title thread improperly worded let clarify trying change person get wrong love flightiness spontaneity,good friend school really nice always fun hang one thing find annoying though constantly drop conversation go,like lot people said neither one candidate time around particularly tickled fancy election full high emotion either side aisle understand,yeah say mine pretty accurate think lot pretty unfair especially haha,seen movie couple year automatically get vibe remember definitely see using te si know exactly want work,like many said similar live paradox introvert us high fe biggest difference see though lie classic sensor intuitive,ignore thumbnail failed attempt adding gif,exactly could said better bet half people take internet misguided surface level critique actually took little time research study,member mbti community criticism theory sick hearing one biggest problem lot people throw baby bathwater,grease one personal favorite could totally understand somebody think overrated plot really nothing groundbreaking could see may find boring,could said better saw movie theater family first came thought okay suddenly everybody around talking cinematic,particular order grease breakfast club clueless heather weird science mean girl duff american beauty,haha cause basically every follow nutshell tongue,follower instagram always come second facebook tumblr post picture cat coffee,ever told child apply enough,,agree definitely sound like let ask following question op like think big question like meaning life,haha okay everybody different preference tongue seinfeld personally seen episode several year ago think liked,chose college currently go based number factor first let start saying sinfully indecisive original college list school,oops accidentally posted twice,like others mentioned think one size fit formula form long term relationship couple introvert extrovert marriage may work well others,idea song full memory last year senior year high school maybe beginning year added,sound pretty,hand favorite show time friend know probably popular choice think good reason romanticized enough stay interesting,interesting idea would hard argue prequels better original think flaw exaggerated sure issue think source,star war iv new hope rip carrie fisher debbie reynolds sad,specifically right general main difficulty showing interest people talking involved talking stuff interest mostly,none really avoid conflict like spanish inquisition lot time find odds nt,conversation friend sits silence fifteen minute homework know got really sad know realized matter,attached sled back cousin truck rode around snow bought last minute plane ticket hawaii friend spent weekend parent happy,personally prefer feeler exclusively guess would probably lot time feeler intimidated interaction thinker,type difficult deal swear offended say,know way way late party definitely think predisposed leftist leaning three known socialist sympathy,okay well five month longer point rude really necessary,say title personally girl ever liked either think pretty big difference c est la vie,dom aux fe perceiver ti lower position ne ne se still difficulty able tell two apart overall probably say unless really,,debate friend two hour whether tattoo artist expression somebody else body metaphysical rape kidding night,type unwind relax dancing jamming car playlist watching netflix grabbing coffee friend going mini adventure taking long hot shower hobby activity,thank god tired seeing personality everywhere every time hear somebody say got mbti type personality make skin crawl little bit actually met,like people said sound like maybe,runaround sue dion,actually two question often find giving relationship ni ti loop ever negatively affected relationship,christian encouraging see stayed committed thread two year admit apologetics strong suit though read
